,eng_title,eng_text,eng_text_len,slo_title,slo_text,slo_text_len
11,THE TWELVE HUNTSMEN,"There was once a king’s son who had a bride whom he loved very much. And
when he was sitting beside her and very happy, news came that his father
lay sick unto death, and desired to see him once again before his end.
Then he said to his beloved: ‘I must now go and leave you, I give you
a ring as a remembrance of me. When I am king, I will return and fetch
you.’ So he rode away, and when he reached his father, the latter was
dangerously ill, and near his death. He said to him: ‘Dear son, I wished
to see you once again before my end, promise me to marry as I wish,’ and
he named a certain king’s daughter who was to be his wife. The son was
in such trouble that he did not think what he was doing, and said: ‘Yes,
dear father, your will shall be done,’ and thereupon the king shut his
eyes, and died.

When therefore the son had been proclaimed king, and the time of
mourning was over, he was forced to keep the promise which he had given
his father, and caused the king’s daughter to be asked in marriage, and
she was promised to him. His first betrothed heard of this, and fretted
so much about his faithfulness that she nearly died. Then her father
said to her: ‘Dearest child, why are you so sad? You shall have
whatsoever you will.’ She thought for a moment and said: ‘Dear father,
I wish for eleven girls exactly like myself in face, figure, and size.’
The father said: ‘If it be possible, your desire shall be fulfilled,’
and he caused a search to be made in his whole kingdom, until eleven
young maidens were found who exactly resembled his daughter in face,
figure, and size.

When they came to the king’s daughter, she had twelve suits of
huntsmen’s clothes made, all alike, and the eleven maidens had to put
on the huntsmen’s clothes, and she herself put on the twelfth suit.
Thereupon she took her leave of her father, and rode away with them,
and rode to the court of her former betrothed, whom she loved so dearly.
Then she asked if he required any huntsmen, and if he would take all of
them into his service. The king looked at her and did not know her, but
as they were such handsome fellows, he said: ‘Yes,’ and that he would
willingly take them, and now they were the king’s twelve huntsmen.

The king, however, had a lion which was a wondrous animal, for he knew
all concealed and secret things. It came to pass that one evening he
said to the king: ‘You think you have twelve huntsmen?’ ‘Yes,’ said the
king, ‘they are twelve huntsmen.’ The lion continued: ‘You are mistaken,
they are twelve girls.’ The king said: ‘That cannot be true! How
will you prove that to me?’ ‘Oh, just let some peas be strewn in the
ante-chamber,’ answered the lion, ‘and then you will soon see. Men have
a firm step, and when they walk over peas none of them stir, but girls
trip and skip, and drag their feet, and the peas roll about.’ The king
was well pleased with the counsel, and caused the peas to be strewn.

There was, however, a servant of the king’s who favoured the huntsmen,
and when he heard that they were going to be put to this test he went to
them and repeated everything, and said: ‘The lion wants to make the king
believe that you are girls.’ Then the king’s daughter thanked him, and
said to her maidens: ‘Show some strength, and step firmly on the peas.’
So next morning when the king had the twelve huntsmen called before
him, and they came into the ante-chamber where the peas were lying, they
stepped so firmly on them, and had such a strong, sure walk, that not
one of the peas either rolled or stirred. Then they went away again,
and the king said to the lion: ‘You have lied to me, they walk just like
men.’ The lion said: ‘They have been informed that they were going to
be put to the test, and have assumed some strength. Just let twelve
spinning-wheels be brought into the ante-chamber, and they will go to
them and be pleased with them, and that is what no man would do.’
The king liked the advice, and had the spinning-wheels placed in the
ante-chamber.

But the servant, who was well disposed to the huntsmen, went to them,
and disclosed the project. So when they were alone the king’s daughter
said to her eleven girls: ‘Show some constraint, and do not look round
at the spinning-wheels.’ And next morning when the king had his twelve
huntsmen summoned, they went through the ante-chamber, and never once
looked at the spinning-wheels. Then the king again said to the lion:
‘You have deceived me, they are men, for they have not looked at the
spinning-wheels.’ The lion replied: ‘They have restrained themselves.’
The king, however, would no longer believe the lion.

The twelve huntsmen always followed the king to the chase, and his
liking for them continually increased. Now it came to pass that
once when they were out hunting, news came that the king’s bride was
approaching. When the true bride heard that, it hurt her so much that
her heart was almost broken, and she fell fainting to the ground. The
king thought something had happened to his dear huntsman, ran up to him,
wanted to help him, and drew his glove off. Then he saw the ring which
he had given to his first bride, and when he looked in her face he
recognized her. Then his heart was so touched that he kissed her, and
when she opened her eyes he said: ‘You are mine, and I am yours, and
no one in the world can alter that.’ He sent a messenger to the other
bride, and entreated her to return to her own kingdom, for he had a wife
already, and someone who had just found an old key did not require a new
one. Thereupon the wedding was celebrated, and the lion was again taken
into favour, because, after all, he had told the truth.",1080,Dvanajst_lovcev,"Bil je nekoč kraljevič, ki se je mudil pri svoji nevesti, ki jo je imel močno rad. Ko je sedel tako pri nji in bil dobre volje, pa je prišlo poročilo, da mu je oče na smrt obolel in da ga želi videti pred smrtjo. Kraljevič je dejal svoji ljubljenki: »Kličejo me in zapustiti te moram. Vzemi tu prstan v spomin name. Ko bom kralj, pridem in te popeljem na svoj dom.« Odjezdil je. Ko je prišel k očetu, je bil ta res na smrt bolan in blizu smrti. »Ljubi moj sin,« mu je rekel, »hotel sem te še enkrat videti pred smrtjo. Obljubi mi, da se boš oženil po moji volji.« Imenoval mu je neko kraljično, s katero se še poznala nista, ki naj bi mu postala žena. Sin pa je bil tako zmeden in potrt, da ni nič pomislil in dejal: »Naj se zgodi, dragi oče, kakor želite.« Nato je kralj zaprl oči in umrl. Ko so oklicali sina za kralja in je minil čas žalovanja, je moral izpolniti obljubo, dano očetu, ter je dal zasnubiti kraljično. Obljubili so mu jo. To pa je zvedela njegova prva nevesta in ta nezvestoba jo je tako strašno razžalostila, da je skoraj umrla od žalosti. To videč ji je oče dejal: »Zakaj si tako žalostna, ljuba hčerka moja? Saj ti dam vse, karkoli si poželiš.« Kraljična je za trenutek pomišljala, nato pa je rekla: »Dragi oče, želim si enajst deklet, ki mi bojo po licu, po postavi in po rasti na las podobne.« 

»Naj se ti izpolni želja, če je mogoče,« je odgovoril kralj. In dal je po vsem kraljestvu tako dolgo iskati, da so našli enajst devic, ki so bile njegovi hčeri po licu, po postavi in po rasti na las podobne. Ko so prišle h kraljični, je ukazala napraviti enajst lovskih oblek, čisto enakih. In dekleta so morala obleči lovske obleke in sama je oblekla dvanajsto. Nato se je poslovila od očeta. Odjahala je s svojim spremstvom in prijahala na dvor svojega prejšnjega ženina, ki ga je tako močno ljubila. Vprašala ga je, ali potrebuje kaj lovcev in ali ne bi kar vseh skupaj sprejel v svojo službo. Mladi kralj si jo je ogledal, a je ni spoznal. Ker pa so bili vsi tako zali ljudje, je pristal, češ da jih rad sprejme. Tako je vseh dvanajst prišlo v kraljevo službo. Kralj pa je imel leva, ki je bil kaj prečudna žival. Znano mu je bilo vse, kar je bilo skritega in tajnega. Zgodilo se je, da je nekega dne lev dejal kralju: »Kralj misli, da ima dvanajst lovcev na dvoru?« »Tako je,« je rekel kralj, »dvanajst lovcev je.« Lev pa je nadaljeval: »Kralj se hudo moti, to je dvanajst deklet.« »Ta je pa bosa,« je vzkliknil kralj, »kako mi moreš dokazati to?« »Kralj naj da posuti svojo predsobo z grahom, pa se bo pr&ej prepričal,« je rekel lev. »Moški imajo čvrst korak in če stopijo na grah, se grašek niti ne zgane, dekleta pa ca-pljajo in plesaje podrsavajo, grah pod nogami pa se začne kotaliti.« Kralju je bil ta nasvet kar všeč in je dal svojo predsobo posuti z grahom. Kralj pa je imel nekega služabnika, ki je bil lovcem naklonjen. Ko je slišal, kakšen poskus bojo napravili z njimi, 

je prišel k njim in jim vse povedal: »Lev hoče natveziti kralju, da ste vsi sama dekleta.« Lepo se mu je zahvalila kraljična, nato pa rekla svojini družicam: »Potrudite se malo in stopajte krepko po grahu.« Ko je dal kralj drugo jutro poklicati lovce k sebi in so te prišle v predsobo, kjer je bil posut grah, so tako krepko stopale po njem in imele tako trden in močan korak, da se niti grašek ni zakotalil ali premaknil. Po njihovem odhodu je rekel kralj levu: »Nalagal si me, saj stopajo kot moški.« »Zvedele so, da jih bo kralj preskušal,« je rekel lev. »Potrudile so se. Kralj naj da postaviti dvanajst kolovratov v predsobo. Ko pridejo, se bojo vse veselo ozrle po njih. In tega moški ne stori.« Kralju je bil nasvet všeč in je dal postaviti kolovrate v predsobo. Služabnik pa, ki je bil za lovce, je šel in razkril kraljevo namero. Kraljična je dejala svojim dekletom, ko so bile same: »Potrudite se malo in se nikar ne ozirajte po kolovratih.« Ko je dal kralj naslednje jutro poklicati svojih dvanajst lovcev, so prišle v predsobo in niti z očesom ni nobena trenila proti kolovratom. Ves jezen je rekel kralj levu: »Spet si me nalagal, to so moški, ker se niti ozrli niso po kolovratih.« »Zvedele so, da jih kralj preskuša,« je odgovoril lev. »Zato so se prisilile.« Kralj pa levu ni več verjel. Dvanajsterica lovcev je kralja stalno spremljala na lovu. Kralj jih je imel vedno rajši. Zgodilo se je, da so bili nekoč na lovu, ko je prišla vest, da prihaja kraljeva nevesta. 

Ko je prva nevesta to slišala, jo je tako silno zabolelo srce, da ji je skoraj počilo. Omedlela je in se zgrudila na tla. Kralj je menil, da se je njegovemu dragemu lovcu kaj pripetilo, skočil je k njemu in mu hotel pomagati ter mu slekel rokavico. Tedaj pa je zapazil prstan, ki ga je bil dal svoji prvi nevesti. In ko jo je pogledal v obraz, jo je spoznal. Bil je tako presunjen, da jo je poljubil. Ko pa je odprla oči, je ginjeno dejal: »Ti si moja in jaz sem tvoj in tega nobena sila in obljuba ne more spremeniti.« Poslal je sla k drugi nevesti in jo prosil, naj se vrne v svojo deželo, ker že ima svojo ljubljeno soprogo in da stara ljubezen nikdar ne zarjavi. Potlej pa so slavili poroko in lev je prišel spet v milost, ker je bil vendarle tisti, ki je govoril resnico. 
",959
12,DOCTOR KNOWALL,"There was once upon a time a poor peasant called Crabb, who drove with
two oxen a load of wood to the town, and sold it to a doctor for two
talers. When the money was being counted out to him, it so happened that
the doctor was sitting at table, and when the peasant saw how well he
ate and drank, his heart desired what he saw, and would willingly
have been a doctor too. So he remained standing a while, and at length
inquired if he too could not be a doctor. ‘Oh, yes,’ said the doctor,
‘that is soon managed.’ ‘What must I do?’ asked the peasant. ‘In the
first place buy yourself an A B C book of the kind which has a cock on
the frontispiece; in the second, turn your cart and your two oxen into
money, and get yourself some clothes, and whatsoever else pertains to
medicine; thirdly, have a sign painted for yourself with the words: “I
am Doctor Knowall,” and have that nailed up above your house-door.’ The
peasant did everything that he had been told to do. When he had doctored
people awhile, but not long, a rich and great lord had some money
stolen. Then he was told about Doctor Knowall who lived in such and such
a village, and must know what had become of the money. So the lord had
the horses harnessed to his carriage, drove out to the village, and
asked Crabb if he were Doctor Knowall. Yes, he was, he said. Then he was
to go with him and bring back the stolen money. ‘Oh, yes, but Grete, my
wife, must go too.’ The lord was willing, and let both of them have a
seat in the carriage, and they all drove away together. When they came
to the nobleman’s castle, the table was spread, and Crabb was told to
sit down and eat. ‘Yes, but my wife, Grete, too,’ said he, and he seated
himself with her at the table. And when the first servant came with a
dish of delicate fare, the peasant nudged his wife, and said: ‘Grete,
that was the first,’ meaning that was the servant who brought the first
dish. The servant, however, thought he intended by that to say: ‘That is
the first thief,’ and as he actually was so, he was terrified, and said
to his comrade outside: ‘The doctor knows all: we shall fare ill, he
said I was the first.’ The second did not want to go in at all, but was
forced. So when he went in with his dish, the peasant nudged his wife,
and said: ‘Grete, that is the second.’ This servant was equally alarmed,
and he got out as fast as he could. The third fared no better, for the
peasant again said: ‘Grete, that is the third.’ The fourth had to carry
in a dish that was covered, and the lord told the doctor that he was to
show his skill, and guess what was beneath the cover. Actually, there
were crabs. The doctor looked at the dish, had no idea what to say, and
cried: ‘Ah, poor Crabb.’ When the lord heard that, he cried: ‘There! he
knows it; he must also know who has the money!’

On this the servants looked terribly uneasy, and made a sign to the
doctor that they wished him to step outside for a moment. When therefore
he went out, all four of them confessed to him that they had stolen
the money, and said that they would willingly restore it and give him a
heavy sum into the bargain, if he would not denounce them, for if he
did they would be hanged. They led him to the spot where the money was
concealed. With this the doctor was satisfied, and returned to the hall,
sat down to the table, and said: ‘My lord, now will I search in my book
where the gold is hidden.’ The fifth servant, however, crept into the
stove to hear if the doctor knew still more. But the doctor sat still
and opened his A B C book, turned the pages backwards and forwards, and
looked for the cock. As he could not find it immediately he said: ‘I
know you are there, so you had better come out!’ Then the fellow in the
stove thought that the doctor meant him, and full of terror, sprang out,
crying: ‘That man knows everything!’ Then Doctor Knowall showed the lord
where the money was, but did not say who had stolen it, and received
from both sides much money in reward, and became a renowned man.",780,Doktor_vseznalec,"Bil je nekdaj reven kmet, Rak po imenu. Nekega dne je z dvema voloma odpeljal drva v mesto in jih prodal nekemu doktorju. Doktor je ravno sedel pri kosilu, ko je prišel kmet po denar. Kmet je videl, kako doktor lepo je in pije in srce mu je prevzela želja, da bi bil tudi sam doktor. Ko je tako še malo počakal, je nazadnje vprašal, ali bi tudi on lahko postal doktor. »Zakaj pa ne?« je rekel doktor. »To se kaj kmalu lahko zgodi.« »Kaj pa moram storiti?« je vprašal kmet. »Najprej si kupi abecednik, knjigo, ki ima spredaj petelina naslikanega,« ga je doktor začel poučevati. »Drugič: prodaj voz in oba vola in si z denarjem nakupi oblek in vse drugo, kar je potrebno za doktorsko umetnost; tretjič: naroči si tablo z napisom: ,Jaz sem doktor Vseznalec', ter si jo pribij nad hišna vrata.« Kmet je storil vse, kakor mu je bilo naročeno. Ko je tako nekaj časa doktaril, toda ne preveč, se je zgodilo, da so nekemu bogatemu, visokemu gospodu ukradli denar. Ta gospod je zvedel, da živi v tej in tej vasi doktor Vseznalec, ki mora za gotovo vedeti, kam je denar izginil. Zato je dal napreči voz in se odpeljal v tisto vas ter vprašal kmeta, če je on doktor Vseznalec. »Res, to sem jaz,« je rekel krnet. »Pojdite torej z menoj in poiščite ukradeni denar!« 

»Dobro,« je rekel Vseznalec, »a Jera, moja žena, mora tudi z menoj.« Gospod je bil zadovoljen, posadil ju je na voz in vsi trije so se odpeljali. Ko so prišli v plemiški dvorec, je bila miza že pogrnjena in doktor Vseznalec je moral kositi z drugimi vred »Prav, a Jeta, moja žena, tudi,« je rekel in sedel za mizo. Ko je prišel prvi služabnik s skledo dobre jedi, je dregnil krnet svojo ženo in dejal: »Jera, ta je bil prvi!« — misleč pri tem tistega, ki je prinesel prvo jed. Služabnik pa je mislil, .da je hotel reči s tem: »To je bil prvi tat.« In ker je bilo to res, se je ustrašil in je zunaj rekel svojim tovarišem: »Doktor vse ve, slabo jo bomo skupili. Dejal je, da sem bil jaz prvi.« Drugi služabnik se kar ni upal noter, a moral je. Ko je vstopil s svojo skledo v sobo, je kmet dregnil svojo ženo: »Jera, ta je drugi!« Tudi ta služabnik se je hudo prestrašil in se je potrudil, da je bil čimprej zunaj. Tretjemu se ni godilo nič drugače, kajti kmet je rekel svoji ženi: »Jera, ta je tretji!« Četrti je moral prinesti v sobo pokrito skledo in gospod je rekel doktorju, da bi preskusil njegovo umetnost, naj ugane, kaj je v skledi. V njej so bili raki. Kmet je ogledoval skledo in ni vedel, kako bi si pomagal, zato je zamrmral: »Oh, jaz ubogi Rak!« Ko je gospod to slišal, je kriknil: »Glejte ga, res ve, gotovo tudi ve, kdo ima denar.« Služabnik je kar prebledel od groze in je pomežiknil doktorju, naj stopi malo ven. Zunaj so mu vsi štirje priznali, da so ukradli denar, in obljubili, da ga bojo vrnili in mu dali še lepo nagrado povrhu, če jih ne izda, ker bi jim drugače trda predla. Pokazali so mu tudi, kje je denar skrit. 

Doktor je bil zadovoljen s tem, vrnil se je v sobo, sedel za mizo in rekel: »Gospod, zdaj naj še poiščem v tej moji knjigi, kje tiči denar.« Peti služabnik pa se je medtem splazil v peč, da bi slišal, ali ve doktor še kaj več. Ta pa je sedel, odprl svoj abecednik in listal po njem, da bi poiskal petelina. Ko ga pa ni mogel najti, je rekel jezno: »Saj si notri, zato moraš tudi ven.« Tisti v peči pa je mislil, da leti to nanj in je ves prestrašen skočil iz peči ter dejal: »Ta človek vse ve.« Nato je doktor Vseznalec pokazal gospodu, kje je denar, ni pa povedal, kdo ga je ukradel. In tako je od njega in od njih dobil veliko denarja za nagrado in postal nadvse imeniten. 
",673
