,eng_title,eng_text,eng_text_len,slo_title,slo_text,slo_text_len
7,CLEVER ELSIE,"There was once a man who had a daughter who was called Clever Elsie. And
when she had grown up her father said: ‘We will get her married.’ ‘Yes,’
said the mother, ‘if only someone would come who would have her.’ At
length a man came from a distance and wooed her, who was called Hans;
but he stipulated that Clever Elsie should be really smart. ‘Oh,’ said
the father, ‘she has plenty of good sense’; and the mother said: ‘Oh,
she can see the wind coming up the street, and hear the flies coughing.’
‘Well,’ said Hans, ‘if she is not really smart, I won’t have her.’ When
they were sitting at dinner and had eaten, the mother said: ‘Elsie, go
into the cellar and fetch some beer.’ Then Clever Elsie took the pitcher
from the wall, went into the cellar, and tapped the lid briskly as she
went, so that the time might not appear long. When she was below she
fetched herself a chair, and set it before the barrel so that she had
no need to stoop, and did not hurt her back or do herself any unexpected
injury. Then she placed the can before her, and turned the tap, and
while the beer was running she would not let her eyes be idle, but
looked up at the wall, and after much peering here and there, saw a
pick-axe exactly above her, which the masons had accidentally left
there.

Then Clever Elsie began to weep and said: ‘If I get Hans, and we have
a child, and he grows big, and we send him into the cellar here to draw
beer, then the pick-axe will fall on his head and kill him.’ Then she
sat and wept and screamed with all the strength of her body, over the
misfortune which lay before her. Those upstairs waited for the drink,
but Clever Elsie still did not come. Then the woman said to the servant:
‘Just go down into the cellar and see where Elsie is.’ The maid went and
found her sitting in front of the barrel, screaming loudly. ‘Elsie why
do you weep?’ asked the maid. ‘Ah,’ she answered, ‘have I not reason to
weep? If I get Hans, and we have a child, and he grows big, and has to
draw beer here, the pick-axe will perhaps fall on his head, and kill
him.’ Then said the maid: ‘What a clever Elsie we have!’ and sat down
beside her and began loudly to weep over the misfortune. After a while,
as the maid did not come back, and those upstairs were thirsty for the
beer, the man said to the boy: ‘Just go down into the cellar and see
where Elsie and the girl are.’ The boy went down, and there sat Clever
Elsie and the girl both weeping together. Then he asked: ‘Why are you
weeping?’ ‘Ah,’ said Elsie, ‘have I not reason to weep? If I get Hans,
and we have a child, and he grows big, and has to draw beer here, the
pick-axe will fall on his head and kill him.’ Then said the boy: ‘What
a clever Elsie we have!’ and sat down by her, and likewise began to
howl loudly. Upstairs they waited for the boy, but as he still did not
return, the man said to the woman: ‘Just go down into the cellar and see
where Elsie is!’ The woman went down, and found all three in the midst
of their lamentations, and inquired what was the cause; then Elsie told
her also that her future child was to be killed by the pick-axe, when it
grew big and had to draw beer, and the pick-axe fell down. Then said the
mother likewise: ‘What a clever Elsie we have!’ and sat down and wept
with them. The man upstairs waited a short time, but as his wife did not
come back and his thirst grew ever greater, he said: ‘I must go into the
cellar myself and see where Elsie is.’ But when he got into the cellar,
and they were all sitting together crying, and he heard the reason, and
that Elsie’s child was the cause, and the Elsie might perhaps bring one
into the world some day, and that he might be killed by the pick-axe, if
he should happen to be sitting beneath it, drawing beer just at the very
time when it fell down, he cried: ‘Oh, what a clever Elsie!’ and sat
down, and likewise wept with them. The bridegroom stayed upstairs alone
for a long time; then as no one would come back he thought: ‘They must be
waiting for me below: I too must go there and see what they are about.’
When he got down, the five of them were sitting screaming and lamenting
quite piteously, each out-doing the other. ‘What misfortune has happened
then?’ asked he. ‘Ah, dear Hans,’ said Elsie, ‘if we marry each other
and have a child, and he is big, and we perhaps send him here to draw
something to drink, then the pick-axe which has been left up there might
dash his brains out if it were to fall down, so have we not reason to
weep?’ ‘Come,’ said Hans, ‘more understanding than that is not needed
for my household, as you are such a clever Elsie, I will have you,’ and
seized her hand, took her upstairs with him, and married her.

After Hans had had her some time, he said: ‘Wife, I am going out to work
and earn some money for us; go into the field and cut the corn that we
may have some bread.’ ‘Yes, dear Hans, I will do that.’ After Hans had
gone away, she cooked herself some good broth and took it into the field
with her. When she came to the field she said to herself: ‘What shall I
do; shall I cut first, or shall I eat first? Oh, I will eat first.’ Then
she drank her cup of broth and when she was fully satisfied, she once
more said: ‘What shall I do? Shall I cut first, or shall I sleep first?
I will sleep first.’ Then she lay down among the corn and fell asleep.
Hans had been at home for a long time, but Elsie did not come; then said
he: ‘What a clever Elsie I have; she is so industrious that she does not
even come home to eat.’ But when evening came and she still stayed away,
Hans went out to see what she had cut, but nothing was cut, and she
was lying among the corn asleep. Then Hans hastened home and brought
a fowler’s net with little bells and hung it round about her, and she
still went on sleeping. Then he ran home, shut the house-door, and sat
down in his chair and worked. At length, when it was quite dark, Clever
Elsie awoke and when she got up there was a jingling all round about
her, and the bells rang at each step which she took. Then she was
alarmed, and became uncertain whether she really was Clever Elsie or
not, and said: ‘Is it I, or is it not I?’ But she knew not what answer
to make to this, and stood for a time in doubt; at length she thought:
‘I will go home and ask if it be I, or if it be not I, they will be sure
to know.’ She ran to the door of her own house, but it was shut; then
she knocked at the window and cried: ‘Hans, is Elsie within?’ ‘Yes,’
answered Hans, ‘she is within.’ Hereupon she was terrified, and said:
‘Ah, heavens! Then it is not I,’ and went to another door; but when the
people heard the jingling of the bells they would not open it, and she
could get in nowhere. Then she ran out of the village, and no one has
seen her since.",1348,Brihtna_Urska,"Bil je človek, ki je imel hčer, ki so ji rekli Brihtna Urška. Ko je odrasla, je rekel oče: »Omožimo jo.« »Saj,« je rekla mati, »ko bi le prišel kdo, ki bi jo hotel vzeti.« Nazadnje je od daleč prišel nekdo, Janez po imenu, in jo zasnubil, a s pogojem, da je Brihtna Urška tudi resnično pametna. »O,« je rekel oče, »ta ima soli v glavi.« Mati pa je dostavila: »Ah, ta vidi, kako veter teče po cesti, sliši, kako muhe kašljajo.« »No,« je rekel Janez, »če ni zares pametna, je rajši ne vzamem.« Ko so potem sedli za mizo in jedli, je rekla mati: »Stopi, Urška, v klet in prinesi piva.« Brihtna Urška je vzela vrč s stene, šla v klet in med potjo neutrudno klepala s pokrovom, da bi ji hitreje minil čas. Ko je bila spodaj, je prinesla pručko in jo postavila pred sod, da se ji ne bi bilo treba upogibati, pri čemer bi jo lahko začel boleti križ in bi se ji celo poškodoval. Nato je postavila vrč predse in odprla pivo. Medtem ko je pivo teklo, je ogledovala stene od tal do vrha, da ni pustila svojih oči brez dela. Po dolgem ogledovanju sem in tja je zagledala ravno nad seboj kljuko v stropu, ki so jo nepazljivi zidarji pozabili tam. Pametna Urška je začela jokati, govoreč: »Če vzamem Janeza in dobiva otroka in bo ta velik in pošljeva otroka v klet točit pivo, mu lahko pade kljuka na glavo in ga ubije.« 

Tako je sedela in jokala in na vse pretege vreščala zaradi nesreče, ki bi se mogla zgoditi. Tisti zgoraj so čakali pijače, Brihtne Urške pa le ni bilo od nikoder. Zato je gospodinja ukazala dekli: »Pojdi no v klet in poglej, kje tiči Urška.« Dekla je šla in jo našla, kako sedi pred sodom in se na ves glas dere. »Zakaj pa jokaš, Urška?« jo vpraša dekla. »Jojmene,« je odgovorila, »kako bi ne jokala? Če vzamem Janeza in dobiva otroka in bo ta velik in bo moral točiti pivo, mu nemara pade kljuka na glavo in ga ubije.« Nato reče dekla: »Kako je pametna naša Urška!« sede zraven nje in začne tudi sama jokati zaradi nesreče. Čez nekaj časa, ko dekle ni bilo nazaj in so bili zgoraj žejni in željni pijače, je gospodar rekel hlapcu: »Stopi no še ti v klet in poglej, kje sta ostali Urška in dekla.« Hlapec je šel in tam sta sedeli Brihtna Urška in dekla ter skupaj jokali. »Zakaj pa jokata?« je vprašal. »Jojmene,« je rekla Urška, »kaj bi ne jokala? Če vzamem Janeza in dobiva otroka in bo ta velik in bo tu natakal pijačo, mu pade kljuka na glavo in ga ubije.« Nato reče hlapec: »Kako je brihtna naša Urška!« in sede zraven nje ter začne tudi sam na ves glas jokati. Zgoraj so čakali hlapca, ko pa ga ni bilo od nikoder, je rekel gospodar ženi: »Stopi no v klet in poglej, kje je ostala Urška.« Gospodinja je odšla in našla vse tri, kako tarnajo, in je vprašala zakaj. In Urška je povedala, kako bo njenega otroka, ko bo velik in bo prišel pivo točit, ubila kljuka, ko bo padla s stene. 

Nato reče tudi mati: »Kako je brihtna naša Urška!« in sede in začne z drugimi vred jokati. Gospodar je čakal, ko pa še žene ni bilo od nikoder in je bila njegova žeja čedalje hujša, je dejal: »Zdaj moram pa sam v klet pogledat, kje je ostala Urška.« Ko pa pride v klet in so vsi štirje sedeli in jokali in ko je zvedel, da je tega kriv Urškin otrok, ki ga bo morebiti kdaj rodila in ga bo morda kljuka ubila, če bo ravno tisti čas padla s stene, ko bo točil pivo, je vzkliknil: »Kako brihtna Urška!« sedel k njim in začel tudi sam jokati. Ženin je dolgo časa ostal sam; ko pa ni hotelo biti nikogar od nikoder, je pomislil: »Gotovo me spodaj čakajo, pa pojdem še jaz dol, da vidim, kaj nameravajo.« Ko pride dol, vidi, da sedi vsa peterica in se dere in stoka tako pretresljivo, eden huje kakor drugi. »Kakšna nesreča pa se vam je zgodila?« jih pobara ženin. »Oh, dragi Janez,« odgovori Urška, »če se midva vzameva in dobiva otroka in bo velik in ga morebiti pošljeva sem dol točit pijačo, mu lahko tale kljuka, ki je obtičala tamle gori, razbije glavo, če bo padla na tla, da bo pri priči mrtev. Kako ne bi jokali?« »No,« ji je rekel Janez, »več pameti za moje gospodinjstvo ni treba; ker si tako brihtna, Urška, te vzamem za ženo.« Prijel jo je za roko in jo vzel s seboj ter napravil svatbo, ko se je oženil z njo. Ko sta bila že nekaj časa mož in žena, je rekel Janez: »Žena, z doma moram na delo, da kaj zaslužim, ti pa pojdi na polje in požanji žito, da bomo imeli kruha.« »Saj, ljubi Janez, storila bom to.« Ko je Janez odšel, si je Urška skuhala lonec tečnega močnika in ga vzela s seboj na polje. Ko pa pride na njivo, reče sama pri 

sebi »Kaj naj storim? Ali naj prej žanjem ali fužinam? Hej, najprej bom južinala.« Pojedla je svoj lonec močnika. Bila je pošteno sita; in se je vprašala: »Kaj naj storim? Ali naj prej požanjem ali se prej naspim? Hej, najprej bom spala.« Janez je bil že dolgo doma, Urška pa kar ni hotela priti in je pomislil: »Kako brihtno Urško sem dobil, tako je pridna, da še domov ne pride, da bi večerjala.« Ko pa je le ni bilo od nikoder in se je že zvečerilo, je odšel na polje gledat, koliko je požela; videl je, da ni nič požetega in da leži v žitu in spi. Janez se je podvizal domov, vzel ptičjo mrežo z majhnimi kraguljčki, šel spet na njivo in vanjo zavil ženo, ki je še zmerom spala. Nato je pohitel domov, zaklenil hišna vrata in sedel na svoj stol ter začel delati. Naposled, ko se je že čisto stemnilo, se je Brihtna Urška zbudila. Ko je vstala, je vse rožljalo okrog nje in zvončki so ji zvončkljali pri vsakem koraku, ki ga je napravila. Prestrašila se je in se zmedla, da ni vedela, ali je resnično prava Brihtna Urška ali ne, in se vprašala: »Ali sem ali nisem?« Ne vedoč, kaj naj si odgovori na to, je za nekaj časa neodločno obstala. Nazadnje je pomislila, da bi šla domov in vprašala: »Ali sem ali nisem.« Doma bojo že vedeli. Stekla je proti hišnim durim. Ta pa so bila zaklenjena. Potrkala je na okno in zaklicala: »Janez, je Urška doma?« »Je,« je odgovoril Janez, »v hiši je.« »Moj bog, potlej to nisem jaz,« je rekla vsa prestrašena ter odšla pred druga vrata. Ko pa so ljudje slišali zvončkljanje norčevskih kraguljčkov, ji niso hoteli odpreti in Brihtna Urška ni mogla nikjer najti strehe. Nazadnje je pobegnila iz vasi in je ni videl nihče več. 
",1154
8,THE WOLF AND THE SEVEN LITTLE KIDS,"There was once upon a time an old goat who had seven little kids, and
loved them with all the love of a mother for her children. One day she
wanted to go into the forest and fetch some food. So she called all
seven to her and said: ‘Dear children, I have to go into the forest,
be on your guard against the wolf; if he comes in, he will devour you
all--skin, hair, and everything. The wretch often disguises himself, but
you will know him at once by his rough voice and his black feet.’ The
kids said: ‘Dear mother, we will take good care of ourselves; you may go
away without any anxiety.’ Then the old one bleated, and went on her way
with an easy mind.

It was not long before someone knocked at the house-door and called:
‘Open the door, dear children; your mother is here, and has brought
something back with her for each of you.’ But the little kids knew that
it was the wolf, by the rough voice. ‘We will not open the door,’ cried
they, ‘you are not our mother. She has a soft, pleasant voice, but
your voice is rough; you are the wolf!’ Then the wolf went away to a
shopkeeper and bought himself a great lump of chalk, ate this and made
his voice soft with it. Then he came back, knocked at the door of the
house, and called: ‘Open the door, dear children, your mother is here
and has brought something back with her for each of you.’ But the wolf
had laid his black paws against the window, and the children saw them
and cried: ‘We will not open the door, our mother has not black feet
like you: you are the wolf!’ Then the wolf ran to a baker and said: ‘I
have hurt my feet, rub some dough over them for me.’ And when the baker
had rubbed his feet over, he ran to the miller and said: ‘Strew some
white meal over my feet for me.’ The miller thought to himself: ‘The
wolf wants to deceive someone,’ and refused; but the wolf said: ‘If you
will not do it, I will devour you.’ Then the miller was afraid, and made
his paws white for him. Truly, this is the way of mankind.

So now the wretch went for the third time to the house-door, knocked at
it and said: ‘Open the door for me, children, your dear little mother
has come home, and has brought every one of you something back from the
forest with her.’ The little kids cried: ‘First show us your paws that
we may know if you are our dear little mother.’ Then he put his paws
in through the window and when the kids saw that they were white, they
believed that all he said was true, and opened the door. But who should
come in but the wolf! They were terrified and wanted to hide themselves.
One sprang under the table, the second into the bed, the third into the
stove, the fourth into the kitchen, the fifth into the cupboard, the
sixth under the washing-bowl, and the seventh into the clock-case. But
the wolf found them all, and used no great ceremony; one after the
other he swallowed them down his throat. The youngest, who was in
the clock-case, was the only one he did not find. When the wolf had
satisfied his appetite he took himself off, laid himself down under a
tree in the green meadow outside, and began to sleep. Soon afterwards
the old goat came home again from the forest. Ah! what a sight she saw
there! The house-door stood wide open. The table, chairs, and benches
were thrown down, the washing-bowl lay broken to pieces, and the quilts
and pillows were pulled off the bed. She sought her children, but they
were nowhere to be found. She called them one after another by name, but
no one answered. At last, when she came to the youngest, a soft voice
cried: ‘Dear mother, I am in the clock-case.’ She took the kid out, and
it told her that the wolf had come and had eaten all the others. Then
you may imagine how she wept over her poor children.

At length in her grief she went out, and the youngest kid ran with her.
When they came to the meadow, there lay the wolf by the tree and snored
so loud that the branches shook. She looked at him on every side and
saw that something was moving and struggling in his gorged belly. ‘Ah,
heavens,’ she said, ‘is it possible that my poor children whom he has
swallowed down for his supper, can be still alive?’ Then the kid had to
run home and fetch scissors, and a needle and thread, and the goat cut
open the monster’s stomach, and hardly had she made one cut, than one
little kid thrust its head out, and when she had cut farther, all six
sprang out one after another, and were all still alive, and had suffered
no injury whatever, for in his greediness the monster had swallowed them
down whole. What rejoicing there was! They embraced their dear mother,
and jumped like a tailor at his wedding. The mother, however, said: ‘Now
go and look for some big stones, and we will fill the wicked beast’s
stomach with them while he is still asleep.’ Then the seven kids dragged
the stones thither with all speed, and put as many of them into this
stomach as they could get in; and the mother sewed him up again in the
greatest haste, so that he was not aware of anything and never once
stirred.

When the wolf at length had had his fill of sleep, he got on his legs,
and as the stones in his stomach made him very thirsty, he wanted to
go to a well to drink. But when he began to walk and to move about, the
stones in his stomach knocked against each other and rattled. Then cried
he:

 ‘What rumbles and tumbles
  Against my poor bones?
  I thought ‘twas six kids,
  But it feels like big stones.’

And when he got to the well and stooped over the water to drink, the
heavy stones made him fall in, and he drowned miserably. When the seven
kids saw that, they came running to the spot and cried aloud: ‘The wolf
is dead! The wolf is dead!’ and danced for joy round about the well with
their mother.",1110,Volk_in_sedem_kozic,"Bila je nekoč stara koza. Imela je sedem mladih kozic, ki jih je imela rada, kakor ima rada mati svoje otroke. Nekega dne je nameravala iti v gozd po malo krme in je sklicala vseh sedem kozic ter jim dejala: »Dragi otroci, jaz moram v gozd. Pazite se volka. Če pride, vas bo vse požrl s kožo in kostmi. Ta malopridnež se večkrat pretvarja, toda po njegovem raskavem glasu in po njegovih črnih šapah ga boste pr&ej spoznali.« »Dragi mati,« so rekle kozice, »saj bomo lepo pazile, brez skrbi greš lahko z doma.« Stara je zameketala in se mirno odpravila na pot. Ni dolgo trajalo, ko je že nekdo potrkal na hišna vrata in zaklical: »Odprite, ljubi otroci, vaša mamica je prišla in je vsakemu nekaj prinesla.« Kozice pa so spoznale po raskavem glasu, da je volk. »Ne bomo ti odprle!« so odgovorile, »ti nisi naša mati, ta ima mil in ljubek glas, tvoj glas pa je osoren. Ti si volk.« Nato je volk odšel h kramarju in si kupil velik kos krede, ter ga pogoltnil, da mu je glas mileje zvenel. Zatem se je vrnil, potrkal na hišne duri in zaklical: »Odprite, ljubi otroci, vaša mati se je vrnila in je vsakemu nekaj prinesla.« Toda volk je položil svojo črno šapo na okno in ko so otroci to opazili, so rekli: »Ne bomo odprli! Naša mati nima tako črnih nog kakor ti. Ti si volk.« 

Nato je stekel volk k peku in zavzdihnil: »Udaril sem se v nogo, namaži mi jo s testom.« In ko mu je pek namazal nogo, je volk stekel k mlinarju in mu dejal: »Nasuj mi bele moke na sapo.« Mlinar je pomislil: »Tale volk bi rad nekoga preslepil,« in se je uprl. Volk pa mu je zagrozil, da ga bo raztrgal, če ne stori tega. Mlinar se je prestrašil in mu natresel bele moke na šapo. Saj, taki so ljudje! Zdaj je šel malopridnež tretjič k hišnim vratom, potrkal in nežno dejal: »Odprite, otročički! Vaša mamica je prišla domov in je vsakemu nekaj prinesla iz gozda.« Kozice so zaklicale: »Pokaži nam najprej svojo šapo, da bomo vedele, če si res naša draga mamica.« Volk je položil šapo na okno in ko so videle, da je bela, so mislile, da je vse res, kar je dejal, in so odprle vrata. In kdo je vstopil? Volk! Hudo so se prestrašile in so se hotele poskriti. Ena je skočila pod mizo, druga v posteljo, tretja v peč, četrta v kuhinjo, peta v omaro, šesta pod umivalnik, sedma v omarico stenske ure. Volk pa jih je našel, vse, in jih brez pomisleka drugo za drugo požrl; edino najmlajše, tiste v novi omarici, ni našel. Ko si je volk potešil svojo lakoto, je odšel, legel na travo pod drevo in zaspal. Kmalu zatem se vrne stara koza iz gozda. Ah, kakšna slika se je prikazala njenim. očem! Hišne duri nastežaj odprte, miza, stoli in klopi prevrnjeni, skleda za umivanje je bila iv črepinjah, odeja in blazine so bile vse razmetane. Začela je iskati svoje otroke, a nikjer jih ni bilo. Klicala jih je po vrsti z imeni, a nobena se ji ni oglasila. Nazadnje šele, ko je poklicala najmlajšo, je zaklical droben glasek: »Mamica, tukaj sem, v omarici za uro.« 

Rešila je kozico iz omarice in ta ji je povedala, da je prišel volk in vse druge požrl. Lahko si mislite, kako se je koza jokala zaradi svojih ubogih otrok. svoji veliki žalosti je naposled odšla iz hiše in najmlajša kozica je stekla za njo. Na travniku je zagledala volka, ki je ležal pod drevesom in smrčal, da so se kar veje tresle. Začela ga je z vseh strani ogledovati in je videla, da se mu v napihnjenem trebuhu nekaj giblje in cepeta. »Mili bog,« je pomislila, »kaj če so moji ubogi otroci, ki jih je požrl, še pri življenju?« Pri priči je morala mlada kozica steči domov in prinesti škarje, šivanko in sukanec. Potem je stara zverini razparala polni trebuh in komaj je zarezala, že je pokukala iz njega glava mlade kozice. Ko je dalje rezala, je poskakalo iz njega vseh šestero kozic in bile so še vse žive in nepoškodovane. Zver jih je namreč v svoji požrešnosti kar cele pogoltnila. To vam je bilo veselje! Objemale so svojo drago mamico in poskakovale kakor krojaček na svatbi. Mati je dejala: »Pojdite zdaj in prinesite nekaj velikih kamnov, da bomo z njimi tej hudobni živali napolnile trebuh, dokler še spi in smrči.« In vseh sedem kozic je hitro privleklo kamenje, ki so ga stlačile volku v trebuh, kolikor ga je le šlo vanj. Nato ga je stara spet hitro zašila, da ni ničesar opazil in se niti zganil ni. Ko se je volk končno naspal, se je skobacal na noge in ker ga je kamenje v želodcu tako hudo žejalo, je hotel piti iz bliž-njega vodnjaka. Ko pa je začel stopati in se premikati, se je zadevalo kamenje v njegovem trebuhu in trkalo drug ob dru-gega. In volk je jezno zarenčal: »Kaj tako se po trebuhu mi z ropotom kotali? Šest kozličev sem požrl, zdaj kot kamen so težki.« 

Ko je prišel do vodnjaka in se nagnil nad vodo, da bi pil, so ga težki kamni potegnili vanjo. Štrbunknil je v vodnjak in klavrno utonil. Ko so kozice to videle, so pritekle in na ves glas zavriskale: »Volk je mrtev, volk je mrtev!« In od veselja so s svojo mamico zaplesale okrog vodnjaka. 
",907
