,eng_title,eng_text,eng_text_len,slo_title,slo_text,slo_text_len
3,HANSEL AND GRETEL,"Hard by a great forest dwelt a poor wood-cutter with his wife and his
two children. The boy was called Hansel and the girl Gretel. He had
little to bite and to break, and once when great dearth fell on the
land, he could no longer procure even daily bread. Now when he thought
over this by night in his bed, and tossed about in his anxiety, he
groaned and said to his wife: ‘What is to become of us? How are we
to feed our poor children, when we no longer have anything even for
ourselves?’ ‘I’ll tell you what, husband,’ answered the woman, ‘early
tomorrow morning we will take the children out into the forest to where
it is the thickest; there we will light a fire for them, and give each
of them one more piece of bread, and then we will go to our work and
leave them alone. They will not find the way home again, and we shall be
rid of them.’ ‘No, wife,’ said the man, ‘I will not do that; how can I
bear to leave my children alone in the forest?--the wild animals would
soon come and tear them to pieces.’ ‘O, you fool!’ said she, ‘then we
must all four die of hunger, you may as well plane the planks for our
coffins,’ and she left him no peace until he consented. ‘But I feel very
sorry for the poor children, all the same,’ said the man.

The two children had also not been able to sleep for hunger, and had
heard what their stepmother had said to their father. Gretel wept
bitter tears, and said to Hansel: ‘Now all is over with us.’ ‘Be quiet,
Gretel,’ said Hansel, ‘do not distress yourself, I will soon find a way
to help us.’ And when the old folks had fallen asleep, he got up, put
on his little coat, opened the door below, and crept outside. The moon
shone brightly, and the white pebbles which lay in front of the house
glittered like real silver pennies. Hansel stooped and stuffed the
little pocket of his coat with as many as he could get in. Then he went
back and said to Gretel: ‘Be comforted, dear little sister, and sleep in
peace, God will not forsake us,’ and he lay down again in his bed. When
day dawned, but before the sun had risen, the woman came and awoke the
two children, saying: ‘Get up, you sluggards! we are going into the
forest to fetch wood.’ She gave each a little piece of bread, and said:
‘There is something for your dinner, but do not eat it up before then,
for you will get nothing else.’ Gretel took the bread under her apron,
as Hansel had the pebbles in his pocket. Then they all set out together
on the way to the forest. When they had walked a short time, Hansel
stood still and peeped back at the house, and did so again and again.
His father said: ‘Hansel, what are you looking at there and staying
behind for? Pay attention, and do not forget how to use your legs.’ ‘Ah,
father,’ said Hansel, ‘I am looking at my little white cat, which is
sitting up on the roof, and wants to say goodbye to me.’ The wife said:
‘Fool, that is not your little cat, that is the morning sun which is
shining on the chimneys.’ Hansel, however, had not been looking back at
the cat, but had been constantly throwing one of the white pebble-stones
out of his pocket on the road.

When they had reached the middle of the forest, the father said: ‘Now,
children, pile up some wood, and I will light a fire that you may not
be cold.’ Hansel and Gretel gathered brushwood together, as high as a
little hill. The brushwood was lighted, and when the flames were burning
very high, the woman said: ‘Now, children, lay yourselves down by the
fire and rest, we will go into the forest and cut some wood. When we
have done, we will come back and fetch you away.’

Hansel and Gretel sat by the fire, and when noon came, each ate a little
piece of bread, and as they heard the strokes of the wood-axe they
believed that their father was near. It was not the axe, however, but
a branch which he had fastened to a withered tree which the wind was
blowing backwards and forwards. And as they had been sitting such a long
time, their eyes closed with fatigue, and they fell fast asleep. When
at last they awoke, it was already dark night. Gretel began to cry and
said: ‘How are we to get out of the forest now?’ But Hansel comforted
her and said: ‘Just wait a little, until the moon has risen, and then we
will soon find the way.’ And when the full moon had risen, Hansel took
his little sister by the hand, and followed the pebbles which shone like
newly-coined silver pieces, and showed them the way.

They walked the whole night long, and by break of day came once more
to their father’s house. They knocked at the door, and when the woman
opened it and saw that it was Hansel and Gretel, she said: ‘You naughty
children, why have you slept so long in the forest?--we thought you were
never coming back at all!’ The father, however, rejoiced, for it had cut
him to the heart to leave them behind alone.

Not long afterwards, there was once more great dearth throughout the
land, and the children heard their mother saying at night to their
father: ‘Everything is eaten again, we have one half loaf left, and that
is the end. The children must go, we will take them farther into the
wood, so that they will not find their way out again; there is no other
means of saving ourselves!’ The man’s heart was heavy, and he thought:
‘It would be better for you to share the last mouthful with your
children.’ The woman, however, would listen to nothing that he had to
say, but scolded and reproached him. He who says A must say B, likewise,
and as he had yielded the first time, he had to do so a second time
also.

The children, however, were still awake and had heard the conversation.
When the old folks were asleep, Hansel again got up, and wanted to go
out and pick up pebbles as he had done before, but the woman had locked
the door, and Hansel could not get out. Nevertheless he comforted his
little sister, and said: ‘Do not cry, Gretel, go to sleep quietly, the
good God will help us.’

Early in the morning came the woman, and took the children out of their
beds. Their piece of bread was given to them, but it was still smaller
than the time before. On the way into the forest Hansel crumbled his
in his pocket, and often stood still and threw a morsel on the ground.
‘Hansel, why do you stop and look round?’ said the father, ‘go on.’ ‘I
am looking back at my little pigeon which is sitting on the roof, and
wants to say goodbye to me,’ answered Hansel. ‘Fool!’ said the woman,
‘that is not your little pigeon, that is the morning sun that is shining
on the chimney.’ Hansel, however little by little, threw all the crumbs
on the path.

The woman led the children still deeper into the forest, where they had
never in their lives been before. Then a great fire was again made, and
the mother said: ‘Just sit there, you children, and when you are tired
you may sleep a little; we are going into the forest to cut wood, and in
the evening when we are done, we will come and fetch you away.’ When
it was noon, Gretel shared her piece of bread with Hansel, who had
scattered his by the way. Then they fell asleep and evening passed, but
no one came to the poor children. They did not awake until it was dark
night, and Hansel comforted his little sister and said: ‘Just wait,
Gretel, until the moon rises, and then we shall see the crumbs of bread
which I have strewn about, they will show us our way home again.’ When
the moon came they set out, but they found no crumbs, for the many
thousands of birds which fly about in the woods and fields had picked
them all up. Hansel said to Gretel: ‘We shall soon find the way,’ but
they did not find it. They walked the whole night and all the next day
too from morning till evening, but they did not get out of the forest,
and were very hungry, for they had nothing to eat but two or three
berries, which grew on the ground. And as they were so weary that their
legs would carry them no longer, they lay down beneath a tree and fell
asleep.

It was now three mornings since they had left their father’s house. They
began to walk again, but they always came deeper into the forest, and if
help did not come soon, they must die of hunger and weariness. When it
was mid-day, they saw a beautiful snow-white bird sitting on a bough,
which sang so delightfully that they stood still and listened to it. And
when its song was over, it spread its wings and flew away before them,
and they followed it until they reached a little house, on the roof of
which it alighted; and when they approached the little house they saw
that it was built of bread and covered with cakes, but that the windows
were of clear sugar. ‘We will set to work on that,’ said Hansel, ‘and
have a good meal. I will eat a bit of the roof, and you Gretel, can eat
some of the window, it will taste sweet.’ Hansel reached up above, and
broke off a little of the roof to try how it tasted, and Gretel leant
against the window and nibbled at the panes. Then a soft voice cried
from the parlour:

 ‘Nibble, nibble, gnaw,
  Who is nibbling at my little house?’

The children answered:

 ‘The wind, the wind,
  The heaven-born wind,’

and went on eating without disturbing themselves. Hansel, who liked the
taste of the roof, tore down a great piece of it, and Gretel pushed out
the whole of one round window-pane, sat down, and enjoyed herself with
it. Suddenly the door opened, and a woman as old as the hills, who
supported herself on crutches, came creeping out. Hansel and Gretel were
so terribly frightened that they let fall what they had in their
hands. The old woman, however, nodded her head, and said: ‘Oh, you dear
children, who has brought you here? do come in, and stay with me. No
harm shall happen to you.’ She took them both by the hand, and led them
into her little house. Then good food was set before them, milk and
pancakes, with sugar, apples, and nuts. Afterwards two pretty little
beds were covered with clean white linen, and Hansel and Gretel lay down
in them, and thought they were in heaven.

The old woman had only pretended to be so kind; she was in reality
a wicked witch, who lay in wait for children, and had only built the
little house of bread in order to entice them there. When a child fell
into her power, she killed it, cooked and ate it, and that was a feast
day with her. Witches have red eyes, and cannot see far, but they have
a keen scent like the beasts, and are aware when human beings draw near.
When Hansel and Gretel came into her neighbourhood, she laughed with
malice, and said mockingly: ‘I have them, they shall not escape me
again!’ Early in the morning before the children were awake, she was
already up, and when she saw both of them sleeping and looking so
pretty, with their plump and rosy cheeks she muttered to herself: ‘That
will be a dainty mouthful!’ Then she seized Hansel with her shrivelled
hand, carried him into a little stable, and locked him in behind a
grated door. Scream as he might, it would not help him. Then she went to
Gretel, shook her till she awoke, and cried: ‘Get up, lazy thing, fetch
some water, and cook something good for your brother, he is in the
stable outside, and is to be made fat. When he is fat, I will eat him.’
Gretel began to weep bitterly, but it was all in vain, for she was
forced to do what the wicked witch commanded.

And now the best food was cooked for poor Hansel, but Gretel got nothing
but crab-shells. Every morning the woman crept to the little stable, and
cried: ‘Hansel, stretch out your finger that I may feel if you will soon
be fat.’ Hansel, however, stretched out a little bone to her, and
the old woman, who had dim eyes, could not see it, and thought it was
Hansel’s finger, and was astonished that there was no way of fattening
him. When four weeks had gone by, and Hansel still remained thin, she
was seized with impatience and would not wait any longer. ‘Now, then,
Gretel,’ she cried to the girl, ‘stir yourself, and bring some water.
Let Hansel be fat or lean, tomorrow I will kill him, and cook him.’ Ah,
how the poor little sister did lament when she had to fetch the water,
and how her tears did flow down her cheeks! ‘Dear God, do help us,’ she
cried. ‘If the wild beasts in the forest had but devoured us, we should
at any rate have died together.’ ‘Just keep your noise to yourself,’
said the old woman, ‘it won’t help you at all.’

Early in the morning, Gretel had to go out and hang up the cauldron with
the water, and light the fire. ‘We will bake first,’ said the old woman,
‘I have already heated the oven, and kneaded the dough.’ She pushed poor
Gretel out to the oven, from which flames of fire were already darting.
‘Creep in,’ said the witch, ‘and see if it is properly heated, so that
we can put the bread in.’ And once Gretel was inside, she intended to
shut the oven and let her bake in it, and then she would eat her, too.
But Gretel saw what she had in mind, and said: ‘I do not know how I am
to do it; how do I get in?’ ‘Silly goose,’ said the old woman. ‘The door
is big enough; just look, I can get in myself!’ and she crept up and
thrust her head into the oven. Then Gretel gave her a push that drove
her far into it, and shut the iron door, and fastened the bolt. Oh! then
she began to howl quite horribly, but Gretel ran away and the godless
witch was miserably burnt to death.

Gretel, however, ran like lightning to Hansel, opened his little stable,
and cried: ‘Hansel, we are saved! The old witch is dead!’ Then Hansel
sprang like a bird from its cage when the door is opened. How they did
rejoice and embrace each other, and dance about and kiss each other! And
as they had no longer any need to fear her, they went into the witch’s
house, and in every corner there stood chests full of pearls and jewels.
‘These are far better than pebbles!’ said Hansel, and thrust into his
pockets whatever could be got in, and Gretel said: ‘I, too, will take
something home with me,’ and filled her pinafore full. ‘But now we must
be off,’ said Hansel, ‘that we may get out of the witch’s forest.’

When they had walked for two hours, they came to a great stretch of
water. ‘We cannot cross,’ said Hansel, ‘I see no foot-plank, and no
bridge.’ ‘And there is also no ferry,’ answered Gretel, ‘but a white
duck is swimming there: if I ask her, she will help us over.’ Then she
cried:

 ‘Little duck, little duck, dost thou see,
  Hansel and Gretel are waiting for thee?
  There’s never a plank, or bridge in sight,
  Take us across on thy back so white.’

The duck came to them, and Hansel seated himself on its back, and told
his sister to sit by him. ‘No,’ replied Gretel, ‘that will be too heavy
for the little duck; she shall take us across, one after the other.’ The
good little duck did so, and when they were once safely across and had
walked for a short time, the forest seemed to be more and more familiar
to them, and at length they saw from afar their father’s house. Then
they began to run, rushed into the parlour, and threw themselves round
their father’s neck. The man had not known one happy hour since he had
left the children in the forest; the woman, however, was dead. Gretel
emptied her pinafore until pearls and precious stones ran about the
room, and Hansel threw one handful after another out of his pocket to
add to them. Then all anxiety was at an end, and they lived together
in perfect happiness. My tale is done, there runs a mouse; whosoever
catches it, may make himself a big fur cap out of it.",2952,Janko_in_Metka,"Na robu nekega velikega gozda je živel reven drvar s svojo ženo in z dvema otrokoma. Fantku je bilo ime Janko in dekletcu Metka. Drvarjeva družina že tako ni imela kdo ve kaj jesti, ko pa je nastopilo nerodovitno leto, ni mogel drvar zaslužiti niti vsakdanjega kruha. Ko je tako ponoči premišljeval v svoji postelji in se od skrbi premetaval, je vzdihnil in dejal svoji ženi: »Kaj bo z nami? Kako naj preživiva svoja uboga otroka, ko še zase nimava ničesar več?« »Veš kaj, mož,« je odgovorila žena, »jutri navsezgodaj od- peljiva otroka v gozd v najgostejšo goščo. Tam zakuriva ogenj in dajva vsakemu še košček kruha, nato pa se odpraviva na svoje delo in ju pustiva sama. Tako ne bosta več našla poti domov in se jih bova odkrižala.« »Ne, žena,« je rekel mož, »tega ne bom storil. Srce mi ne da, da bi puščal otroka sama v gozdu. Saj pridejo divje zveri in ju raztrgajo.« »O, ti bedak,« je rekla na to žena, »po tvojem naj potemtakem vsi štirje od lakote umremo. Ostane nam samo to, da izoblaš deske za mrtvaške krste.« In mu ni dala miru, dokler ni pristal. »Uboga otroka pa se mi vseeno smilita!« je dejal mož. Tudi lačna otroka nista mogla zaspati in sta slišala, kaj je mačeha rekla očetu. Metka je bridko zajokala in rekla Janku: »To je najin konec!«
»Tiho, Metka,« je rekel Janko, »nič ne skrbi, jaz si bom že kaj izmislil za naju.« In ko sta stara dva zaspala, je vstal, oblekel svoj suknjič, odprl zunanja vrata in se splazil ven. Mesec je jasno svetil in belo kamenje, ki je ležalo pred kočo, je sijalo kakor sami srebrniki. Janko se je sklonil in si vse žepe natlačil s kamenčki. Nato je šel nazaj v hišo in dejal Metki: »Nič ne skrbi, draga sestrica, kar mirno zaspi, vse bo še dobro.« In je legel nazaj v svojo posteljo. Zgodaj zjutraj, še preden je vzšlo sonce, je že prišla mačeha in zbudila otroka: »Vstanita, lenuha, v gozd grerilo po drva.« Nato je dala vsakemu košček kruha in rekla: »Tu imata nekaj za kosilo, a ne pojejta takoj, ker ne dobita nič drugega.« Metka je dala kruh pod prepasnik, ker je imel Janko vse žepe natlačene s kamenčki. Nato so se vsi štirje odpravili na pot proti gozdu. Ko so že nekaj časa hodili, se je Janko ustavil in se oziral nazaj proti hiši. Tako se je ustavljal in oziral venomer. »Kaj pa se kar naprej ustavljaš in zijaš nazaj, Janko? Pazi in ne pozabi na svoje noge,« je rekel oče. »Oh, oče,« je dejal deček, »po svoji beli mucki se oziram. Ta sedi na strehi in se poslavlja od mene.« »Bedak,« je rekla mati, »to ni tvoja bela mačka, to je jutranje sonce, ki sije na dimnik.« Janko pa se ni oziral po mački, temveč je vsakič vrgel na pot po en svetal kamenček iz žepa. Ko so prišli v sredo gozda, je dejal oče: »Naberita drv, otroka, zakuril bom ogenj, da vaju ne bo zeblo.« Janko in Metka sta nanosila celo goro dračja. Prižgali so ga in ko je ogenj visoko vzplapolal, je rekla ženska: »Zdaj pa lezita k ognju, otroka, in se odpočijta, midva z očetom greva v gozd sekat les. Ko opraviva, se vrneva po vaju.«
 Janko in Metka sta sedela ob ognju in ko je bilo poldne, sta pojedla vsak svoj košček kruha. Ves čas sta slišala udarce sekire in bilo je, kakor da seka oče nekje v bližini. To pa ni bila sekira, marveč veja, ki jo je oče privezal ob trhlo drevo in je v vetru udarjala sem in tja. Otroka sta tako dolgo sedela ob ognju, da so se jima od utrujenosti začele zapirati oči. Trdno sta zaspala. Ko sta se zbudila, je bila že črna noč. Metka je začela jokati in je rekla : »Kako prideva zdaj iz tega gozda?« »Samo majceno počakaj,« jo je tolažil Janko. »Ko vzide mesec, bova že našla pot.« Ko se je prikazala luna na nebu, je Janko prijel sestrico za roko in šel za kamenčki, ki so se iskrili kakor novo kovani srebrniki in jima kazali pot. Hodila sta vso noč in prišla šele v svitu naslednjega dne spet do domače hiše. Potrkala sta na vrata in ko je ženska odprla in videla, da sta onadva, je rekla: »Otroka malopridna, kaj pa sta tako dolgo spala v hosti. Z očetom sva že mislila, da se nočeta vrniti.« Oče pa se ju je razveselil, kajti v srcu ga je grizlo, da ju je bil pustil tako sama. Minilo je nekaj časa, pa je spet iz vseh kotov pritisnilo pomanjkanje. In otroka sta slišala, kako je mačeha rekla ponoči očetu v postelji : »Spet nam je pošel ves živež, samo pol hlebca kruha še imamo, potlej bo pesmi konec. Otroka morata z doma. Odvedla ju bova še globlje v gozd, da ne bosta našla več poti iz njega. Drugače ni rešitve za naju.« Drvarju je bilo težko pri srcu in pomislil je: »Bolje bi bilo, da bi zadnji grižljaj delil s svojima otrokoma.«
 Toda pri ženski je bilo bob ob steno vse, kar je dejal. Oštevala ga je in ga obsipala z očitki. In ko je drvar že enkrat pristal, je moral še drugič. Otroka pa sta bila budna in sta slišala ves ta pomenek. Ko sta stara dva zaspala, je Janko spet vstal, hotel ven po kamenčke kakor zadnjikrat, toda ženska je zaklenila vrata in Janko ni mogel iz hiše. Vseeno pa je pomiril sestrico, ki je jokala: »Nič ne jokaj, Metka, kar mirno spi. Vse bo še dobro.« Navsezgodaj je prišla mačeha in vrgla otroka iz postelje. Dobila sta vsak svoj košček kruha, ki pa je bil še manjši kakor zadnjikrat. Na poti proti gozdu je Janko drobil kruh v žepu, se večkrat ustavil in vrgel drobtinico na pot. »Kaj pa se ustavljaš, Janko, in gledaš nazaj?« je rekel oče. »Pojdi svojo pot.« »Po svojem golobčku se oziram, ki sedi na strehi in se hoče posloviti od mene,« je odgovoril Janko. »Bedak,« je rekla ženska, »to ni tvoj golob, to je jutranje sonce, ki sije na dimnik.« Janko pa je polagoma zmetal vse drobtinice na pot. Mačeha je odvedla otroka še globlje v gozd, v tako goščo, kakršne še živ dan nista videla. Tam so spet zakurili velik ogenj in mačeha je rekla: »Kar lepo sedita tukaj, otroka, in če bosta trudna, lahko malo zaspita. Z očetom greva v gozd sekat les, in zvečer, ko opraviva svoje delo, prideva po vaju.« Opoldne je Metka delila svoj košček kruha z Jankom, ki je svojega raztrosil po poti. Nato sta zaspala. Minil je že večer, k ubogima otrokoma pa ni bilo žive duše. Prebudila sta se šele v črni noči in Janko je miril svojo sestrico in ji rekel: »Kar počakaj, Metka, da je miril svojo sestrico in ji rekel: »Kar počakaj, Metka, da
vzide mesec. Potlej bova lahko videla drobtinice, ki sem jih natrosil, da nama pokažejo pot domov.« Ko je vzšla luna, sta se odpravila, a nobene drobtinice ni bilo več na poti, kajti tisoč in tisoč ptic, ki so letale po gozdu in po polju, jih je pozobalo. »Tudi tako bova našla pot,« je rekel Janko Metki. A nista je našla. Hodila sta vso noč in še cel dan od jutra do večera, a nista prišla iz gozda. Bila sta zelo lačna, ker nista imela nič ,drugega kakor nekaj jagod, ki sta jih nabrala. Bila sta tudi že tako utrujena, da ju noge niso hotele več nositi. Tako sta legla pod neko drevo in zaspala. To je bilo že tretje jutro, odkar sta odšla iz hiše svojega očeta. Vzela sta spet pot pod noge, a sta zašla še globlje v gozd. Čutila sta, da bosta omagala in umrla, če ne pride kmalu kakšna pomoč. Ko je bilo okrog poldne, sta zagledala lepo, snežno belo ptico, ki je sedela na veji in tako prelepo gostolela, da sta se ustavila in ji prisluhnila. Ko je utihnila, je razpela krila in poletavala pred njima. Otroka sta šla za ptico, dokler nista prišla do neke hišice, kjer je ptica sedla na streho. Ko pa sta prišla čisto blizu, sta opazila, da je hišica iz kruha sezidana in s štrukeljčki pokrita; okenca pa so bila iz svetlega sladkorčka. »Tega se pa kar lotiva,« je rekel Janko Metki. »Privoščiva si pošteno južino. Jaz bom pojedel košček strehe, ti, Metka, pa vzemi košček okna, da se boš posladkala.« Janko je segel z roko in odlomil košček strehe, da bi videl, kako tekne. Metka pa se je lotila šipe in začela hrustati. Tedaj se je oglasil tenek glas iz sobe: »Hrst, brst, kateri miško kruši, hrusta mojo hiško«
 Otroka pa sta odgovorila »Vetrc, vetrc iz neba okrog hišice pihlja,« in sta jedla dalje ter se nista dala motiti. Janko, ki mu je streha prav dobro teknila, jo je iztrgal velik kos in Metka je potegnila ven celo okroglo šipo, sedla na tla in si privoščila. Tedaj pa so se nenadoma odprla vrata in ven je prišantala kakor zemlja stara ženska, ki se je opirala na bergle. Janko in Metka sta se tako prestrašila, da jima je popadalo na tla vse, kar sta držala v rokah. Starka pa je zmajevala z glavo in govorila: »Ejej, ljuba otroka moja, kdo pa vaju je pripeljal sem? Stopita no v hišo in ostanita pri meni. Nič hudega se vama ne bo zgodilo.« a se vama ne bo zgodilo.« Prijela ju je za roko in ju odpeljala v hišico. Tam so jima pripravili dobro kosilo, mleko in cvrtnjak s sladkorjem, jabolka in orehe. Nato so belo postlali dve lepi posteljici in Janko in in orehe. Nato so belo postlali dve lepi posteljici in Janko in Metka sta legla in sladko zaspala. Starka pa se je samo delala dobro. Bila je hudobna čarovnica, ki je prežala na otroke in je svojo kruhasto hišico sezidala samo zato, da bi jih privabila. Ko je prišel kak otrok v njeno samo zato, da bi jih privabila. Ko je prišel kak otrok v njeno oblast, ga je ubila, skuhala in ga požrla. Čarovnice imajo rdeče oči in ne morejo videti daleč. Imajo pa tenek voh kakor živali in zaduhajo, če pridejo ljudje v bližino. Ko sta se Janko in Metka bližala njeni hišici, se je ženska zlobno zasmejala in posmehljivo dejala: »Ta dva sta mi padla v kremplje. Ne bosta mi popihala.« Zgodaj zjutraj, ko sta otroka še spala, je že vstala in ko ju je videla, kako milo spita s svojimi polnimi rdečimi lički, je zamrmrala predse: »To bo slasten prigrizek!«
 Zgrabila je Janka s svojimi koščenimi rokami ga odnesla v majhen hlev in ga zaprla za zamrežena vrata. Ni mu pomagalo, da je kričal in vpil na vse grlo. Nato je stopila k Metki in jo stresla, da se je zdramila. Zaklicala ji je: »Vstani, zaspanka, nanosi vode in skuhaj svojemu bratu kaj dobrega. Zaprt je v hlevu, da se bo zredil. Ko bo lepo rejen, ga bom pojedla.« Metka je bridko zajokala, a bilo je vse zaman, morala je storiti, kar je zahtevala hudobna čarovnica. Tako so ubogemu Janku kuhali najboljše jedi, Metka pa je dobivala samo ostanke. Vsako jutro je odšantala starka k hlevčku in zaklicala: »Janček, pomoli ven svoj prst, da bom potipala, ali boš kmalu rejen.« Janko pa ji je pomolil koščico in starka, ki je imela brljave oči, tega ni mogla videti in je mislila, da so Jankovi prsti, ter se čudila, da se kar nič ne zredi. Ko so minili štirje tedni in je Janko ostal še kar suh, jo je premagala nepotrpežljivost in ni marala več čakati. Metka,« je zaklicala deklici, »skoči hitro in nanosi vodo. Naj bo Janko debel ali suh, jutri ga bom zaklala in ga skuhala.« Oh, kako je jokala uboga deklica, ko je morala nositi vodo! Kako so ji tekle solze po licih! »Bolje bi bilo, da bi naju požrle divje zveri v gozdu. Tako bi vsaj skupaj umrla!« je tarnala. »Nikar se ne cmeri,« jo je osorno zavrnila starka, »to vse ti ne bo prav nič pomagalo.« Metka je morala zgodaj zjutraj obesiti kotel z vodo in zakuriti ogenj. »A najprej moramo speči kruh,« je rekla starka. »Krušno peč sem že zakurila in tudi testo zamesila!«
Pahnila je ubogo Metko pred peč, iz katere so že švigali plameni. »Zlezi vanjo,« je rekla čarovnica, »in poglej, ali je dovolj zakurjeno, da lahko damo kruh vanjo.« In če bi jo bila Metka poslušala, bi čarovnica zaprla v jo peč, da bi se Metka spekla v nji. In potem bi o bila pojedla. Metka pa je uganila, kaj stara namerava in je rekla: »Ne vem, kako naj to storim. Kako pa pridem vanjo?« »Gos neumna, saj je odprtina dovolj velika, vidiš, še jaz bi lahko zlezla vanjo,« je rekla stara, se primajala in vtaknila glavo v peč. Metka pa jo je krepko sunila, da je zdrsnila vanjo. Zaprla je železna vrata za njo. Oh, kako grozansko je zavreščala stara! A nič ni pomagalo. Čarovnica je morala zgoreti. Metka je jadrno stekla naravnost k Janku, odprla njegov hlevček in zaklicala: »Janko, rešena sva, stara čarovnica je mrtva!« Janko je skočil ven kakor ptička iz kletke, če ji odpreš vratca. Kako sta se veselila! Vrgla sta se drug drugemu okoli vratu, poskakovala in se poljubljala! In ker se jima ni bilo treba ničesar več bati, sta šla v čarovničino hišo. Tam pa so bili po vseh kotih zabojčki z biseri in dragulji. »Ti so pa veliko boljši kakor kamenčki,« je rekel Janko in si jih natlačil v žepe, kolikor je mogel. »Tudi jaz bi rada kaj prinesla domov,« je rekla Metka ter si z njimi napolnila svoj predpasniček. »Zdaj pa jo pobrišiva od tod,« je dejal Janko, »da prideva iz tega čarovniškega gozda.« a nekaj Ko sta hodila ur, sta prišla do velike vode. »Saj ne moreva čez videti.« ,« je dejal Janko, »ne brvi ne mostu ni videti.«
 »Tudi nobene barčice ni na vodi,« mu je odgovorila Metka »tamle pa plava bela račka. Če jo poprosim, nama bo gotovo Pomagala čez vodo.« Vzkliknila je: »Račka, ljuba račka ti, ker ni mostička ne brvi, midva prosiva lepo, da naju prepelješ čez vodo.« In račka je res priplavala in Janko ji je sedel na hrbet in rekel sestrici, naj sede zraven njega. »Ne,« je odgovorila Metka, »to bi bilo za račko pretežko, drugega za drugim naju bo.« In dobra račka je res storila tako in ko sta bila srečno na drugem bregu in ko sta še nekaj časa hodila, se jima je zazdel gozd čedalje bolj znan in domač. In nazadnje sta od daleč zagledala hišo svojega očeta. Začela sta teči, planila sta v sobo in se vrgla očetu okrog vratu. Odkar je revni drvar pustil svoja otroka v gozdu, ni imel niti trenutka miru in pokoja več. Njegova hudobna žena pa je bila medtem umrla. Metka je stresla iz svojega predpasnička bisere in dragulje, da so se kar trkljali po izbi. Janko pa ",2484
