,slo_title,slo_text,slo_text_len
0,Bremenski_mestni_godci,"Imel je človek osla, ki je že leta in leta potrpežljivo vlačil vreče žita v mlin. A moči so mu začele pešati, tako da je bil čedalje manj sposoben za delo. In je prišlo gospodarju na misel, da bi ga nehal hraniti. Osel pa je zaduhal, da piha slab veter, pobegnil je in se odpravil v mesto Bremen. Upal je, da bo tam lahko dobil službo mestnega godca. Ko je nekaj časa tako koračil, je naletel na lovskega psa, ki je ležal na poti in sopel, kakor kdo, ki se je do smrti utrudil od tekanja. »Kaj pa tako sopeš, Grabavs?« ga vpraša osel. »Oh,« odvrne pes. »Star sem in vsak dan slabši, niti za lov nisem več. Ker me je gospodar hotel ubiti, sem jo ucvrl, zdaj pa ne vem, kako naj si zaslužim skorjico kruha?« »Veš kaj?« mu odvrne osel. »Jaz sem namenjen v Bremen, da postanem tam mestni godec. Jaz bom igral lutnjo, ti bi pa udarjal na boben.« Pes je bil zadovoljen in je šel z njim. Ni dolgo trajalo, kar sta srečala mačko, ki je čepela na poti in se nadvse kislo in čemerno držala. »Kaj pa ti gre tako narobe, Čohačka stara?« jo je vprašal osel. »Joj, joj, kdo pa bi bil vesel, če se mu grlo stiska?« je rekla mačka. »Ker sem prišla v leta in so se mi zobje skrhali ter rajši za pečjo sedim in predem, kakor pa bi lovila miši, me je hotela gospodinja utopiti. Jaz sem se ji sicer iztrgala, a zdaj mi je potreben dober svet: kam naj grem?« 

»Pojdi z nama v Bremen. Saj si mojster v nočni muziki tam lahko postaneš mestni godec.« Mački se je zdelo to pametno, pa je šla z njima. Nato so begunci prišli mimo nekega dvorišča; pred vrati je stal domači petelin in na vse pretege »Kaj pa se dereš, da reže v mozeg in v kosti?« mu je rekel osel. »Kaj hočeš s tem?« »Prerokoval sem lepo vreme,« je dejal petelin, »ker je jutri praznik in se mora perilo posušiti. Ker pa pridejo jutri gostje, nima gospodinja usmiljenja z menoj in je naročila kuharici, da me bo jutri v juhi pojedla in zato si moram že danes dati odrezati glavo. Zdaj se derem na vse grlo, dokler se še lahko.« »Eh, kaj, Rdečeglavček,« mu reče osel, »pojdi rajši z nami! V Bremen smo namenjeni, kaj boljšega kakor smrt povsod lahko najdeš. Lep glas imaš in če skupaj zaigramo, bo to odlična muzika.« Petelinu je bil predlog všeč in vsi štirje so odšli na pot. Vendar pa v enem dnevu niso mogli priti do mesta Bremen in tako so prišli zvečer v neki gozd, kjer so hoteli prenočiti. Osel in pes sta legla pod visoko drevo, mačka in petelin pa sta se spravila na veje, a petelin je zletel prav do vrha, kjer je bilo zanj najbolj varno. Preden je zaspal, se je še enkrat ozrl na vse štiri strani in zazdelo se mu je, da vidi v daljavi majhno iskrico, zaklical je tovarišem, da mora biti nedaleč od tod neka hiša, v kateri se nekaj svetlika. »Potemtakem se moramo dvigniti,« je rekel osel, »in oditi tja, ker imamo tukaj slabo prenočišče.« Pes je menil, da bi mu malo kosti z mesom ne delo slabo. Tako so se odpravili na pot proti kraju, od koder je prihajal svetloba. Videli so, da je luč čedalje večja, dokler niso prišli 

pred dobro razsvetljeno razbojniko hišo. Osel se je kot največji približal oknu in pogledal v hišo. »Kaj pa vidiš, Sivko?« je vprašal petelin. »Kaj vidim?« je odvrnil osel. »Lepo pogrnjeno mizo vidim • z dobrimi jedmi in pijačami. Okrog mize pa sede razbojniki in se mastijo.« »To bi bilo nekaj za nas,« je dejal petelin. »Saj, saj, oh, če bi bili mi tam notri,« je zavzdihnil osel. Nato so se začele živali posvetovati, kaj naj napravijo, da bi pregnale razbojnike iz hiše. Končno so se domislile. Osel se je moral s prednjimi parklji postaviti na okno, pes skočiti oslu na hrbet, mačka zlesti na psa in nazadnje je zletel petelin kvišku ter sedel mački na glavo. Potem so začeli na dano znamenje vsak svojo pesem: osel je rigal, pes lajal, mačka mijavkala in petelin zakikirikal. Nato so planili skozi okno v izbo, da so zažvenketale šipe. Razbojniki so ob strahovitem vrišču planili na noge, ker so mislili, da je prišla neka prikazen, ter so v silnem strahu pobegnili v gozd. Naši štirje prijatelji pa so sedli za mizo, se zadovoljili s tem, kar je ostalo, ter se tako natlačili, kakor da najmanj štiri tedne ne bojo imeli kaj dati v usta. Ko so se naši štirje godci nasitili, so utrnili luč in si poiskali vsak svoje ležišče, kakor se je komu prileglo in mu bilo pogodu. Osel je legel na gnoj, pes za vrata, mačka na ognjišče k toplemu pepelu in petelin na kurjo gredo. In ker so bili utrujeni od dolge poti, so kmalu tudi zaspali. Ko je minila polnoč in so roparji od daleč videli, da ni več luči v hiši in da je videti vse mirno, je rekel njihov kolovodja: »Ne bi se smeli pustiti tako hitro ugnati v kozji rog.« Poslal je enega razbojnika, naj pogleda in preišče hišo. Vse je bilo tiho. Stopil je v kuhinjo, da bi prižgal svečo. In ker je imel žareče, ognjene mačkine oči za tleče oglje, je primaknil k njim žveplenko, da bi jo prižgal. Mačka pa ni 

poznala šale. Skočila mu je v obraz ter ga začela praskati. Zelo se je razbojnik prestrašil, stekel je in hotel skozi dvoriščna vrata na dvorišče, pes pa, ki je ležal tam, je skočili in ga ugriznil v nogo. In ko je razbojnik oddirjal po dvorišču mimo gnoja, mu je dal še osel pošteno brco z zadnjo nogo. Petelin pa, ki ga je ves hrup prebudil iz spanja, se je zdramil, in na vse grlo zapel z grede: »Kikiriki!« Razbojnik je tekel, kolikor so ga nesle noge, k svojemu poglavarju in mu sporočil: »Hu, v tisti hiši gospodari neka grozovita čarovnica. Puhnila je vame in mi s svojimi dolgimi nohti razpraskala ves obraz. In pred vrati stoji nekdo z nožem, ki me je usekal v nogo, na dvorišču leži neka črna pošast, ki me je oplazila z lesenim betom, na strehi pa je sedel sodnik in vpil: ,Pripeljite mi lopova!' Zato sem pobegnil.« Od takrat si roparji niso več upali v hišo, štirim bremenskim godcem pa je bilo tako všeč v njej, da niso hoteli več ven. In če niso že umrli, živijo še dandanes. ",1088
1,Brihtna_Urska,"Bil je človek, ki je imel hčer, ki so ji rekli Brihtna Urška. Ko je odrasla, je rekel oče: »Omožimo jo.« »Saj,« je rekla mati, »ko bi le prišel kdo, ki bi jo hotel vzeti.« Nazadnje je od daleč prišel nekdo, Janez po imenu, in jo zasnubil, a s pogojem, da je Brihtna Urška tudi resnično pametna. »O,« je rekel oče, »ta ima soli v glavi.« Mati pa je dostavila: »Ah, ta vidi, kako veter teče po cesti, sliši, kako muhe kašljajo.« »No,« je rekel Janez, »če ni zares pametna, je rajši ne vzamem.« Ko so potem sedli za mizo in jedli, je rekla mati: »Stopi, Urška, v klet in prinesi piva.« Brihtna Urška je vzela vrč s stene, šla v klet in med potjo neutrudno klepala s pokrovom, da bi ji hitreje minil čas. Ko je bila spodaj, je prinesla pručko in jo postavila pred sod, da se ji ne bi bilo treba upogibati, pri čemer bi jo lahko začel boleti križ in bi se ji celo poškodoval. Nato je postavila vrč predse in odprla pivo. Medtem ko je pivo teklo, je ogledovala stene od tal do vrha, da ni pustila svojih oči brez dela. Po dolgem ogledovanju sem in tja je zagledala ravno nad seboj kljuko v stropu, ki so jo nepazljivi zidarji pozabili tam. Pametna Urška je začela jokati, govoreč: »Če vzamem Janeza in dobiva otroka in bo ta velik in pošljeva otroka v klet točit pivo, mu lahko pade kljuka na glavo in ga ubije.« 

Tako je sedela in jokala in na vse pretege vreščala zaradi nesreče, ki bi se mogla zgoditi. Tisti zgoraj so čakali pijače, Brihtne Urške pa le ni bilo od nikoder. Zato je gospodinja ukazala dekli: »Pojdi no v klet in poglej, kje tiči Urška.« Dekla je šla in jo našla, kako sedi pred sodom in se na ves glas dere. »Zakaj pa jokaš, Urška?« jo vpraša dekla. »Jojmene,« je odgovorila, »kako bi ne jokala? Če vzamem Janeza in dobiva otroka in bo ta velik in bo moral točiti pivo, mu nemara pade kljuka na glavo in ga ubije.« Nato reče dekla: »Kako je pametna naša Urška!« sede zraven nje in začne tudi sama jokati zaradi nesreče. Čez nekaj časa, ko dekle ni bilo nazaj in so bili zgoraj žejni in željni pijače, je gospodar rekel hlapcu: »Stopi no še ti v klet in poglej, kje sta ostali Urška in dekla.« Hlapec je šel in tam sta sedeli Brihtna Urška in dekla ter skupaj jokali. »Zakaj pa jokata?« je vprašal. »Jojmene,« je rekla Urška, »kaj bi ne jokala? Če vzamem Janeza in dobiva otroka in bo ta velik in bo tu natakal pijačo, mu pade kljuka na glavo in ga ubije.« Nato reče hlapec: »Kako je brihtna naša Urška!« in sede zraven nje ter začne tudi sam na ves glas jokati. Zgoraj so čakali hlapca, ko pa ga ni bilo od nikoder, je rekel gospodar ženi: »Stopi no v klet in poglej, kje je ostala Urška.« Gospodinja je odšla in našla vse tri, kako tarnajo, in je vprašala zakaj. In Urška je povedala, kako bo njenega otroka, ko bo velik in bo prišel pivo točit, ubila kljuka, ko bo padla s stene. 

Nato reče tudi mati: »Kako je brihtna naša Urška!« in sede in začne z drugimi vred jokati. Gospodar je čakal, ko pa še žene ni bilo od nikoder in je bila njegova žeja čedalje hujša, je dejal: »Zdaj moram pa sam v klet pogledat, kje je ostala Urška.« Ko pa pride v klet in so vsi štirje sedeli in jokali in ko je zvedel, da je tega kriv Urškin otrok, ki ga bo morebiti kdaj rodila in ga bo morda kljuka ubila, če bo ravno tisti čas padla s stene, ko bo točil pivo, je vzkliknil: »Kako brihtna Urška!« sedel k njim in začel tudi sam jokati. Ženin je dolgo časa ostal sam; ko pa ni hotelo biti nikogar od nikoder, je pomislil: »Gotovo me spodaj čakajo, pa pojdem še jaz dol, da vidim, kaj nameravajo.« Ko pride dol, vidi, da sedi vsa peterica in se dere in stoka tako pretresljivo, eden huje kakor drugi. »Kakšna nesreča pa se vam je zgodila?« jih pobara ženin. »Oh, dragi Janez,« odgovori Urška, »če se midva vzameva in dobiva otroka in bo velik in ga morebiti pošljeva sem dol točit pijačo, mu lahko tale kljuka, ki je obtičala tamle gori, razbije glavo, če bo padla na tla, da bo pri priči mrtev. Kako ne bi jokali?« »No,« ji je rekel Janez, »več pameti za moje gospodinjstvo ni treba; ker si tako brihtna, Urška, te vzamem za ženo.« Prijel jo je za roko in jo vzel s seboj ter napravil svatbo, ko se je oženil z njo. Ko sta bila že nekaj časa mož in žena, je rekel Janez: »Žena, z doma moram na delo, da kaj zaslužim, ti pa pojdi na polje in požanji žito, da bomo imeli kruha.« »Saj, ljubi Janez, storila bom to.« Ko je Janez odšel, si je Urška skuhala lonec tečnega močnika in ga vzela s seboj na polje. Ko pa pride na njivo, reče sama pri 

sebi »Kaj naj storim? Ali naj prej žanjem ali fužinam? Hej, najprej bom južinala.« Pojedla je svoj lonec močnika. Bila je pošteno sita; in se je vprašala: »Kaj naj storim? Ali naj prej požanjem ali se prej naspim? Hej, najprej bom spala.« Janez je bil že dolgo doma, Urška pa kar ni hotela priti in je pomislil: »Kako brihtno Urško sem dobil, tako je pridna, da še domov ne pride, da bi večerjala.« Ko pa je le ni bilo od nikoder in se je že zvečerilo, je odšel na polje gledat, koliko je požela; videl je, da ni nič požetega in da leži v žitu in spi. Janez se je podvizal domov, vzel ptičjo mrežo z majhnimi kraguljčki, šel spet na njivo in vanjo zavil ženo, ki je še zmerom spala. Nato je pohitel domov, zaklenil hišna vrata in sedel na svoj stol ter začel delati. Naposled, ko se je že čisto stemnilo, se je Brihtna Urška zbudila. Ko je vstala, je vse rožljalo okrog nje in zvončki so ji zvončkljali pri vsakem koraku, ki ga je napravila. Prestrašila se je in se zmedla, da ni vedela, ali je resnično prava Brihtna Urška ali ne, in se vprašala: »Ali sem ali nisem?« Ne vedoč, kaj naj si odgovori na to, je za nekaj časa neodločno obstala. Nazadnje je pomislila, da bi šla domov in vprašala: »Ali sem ali nisem.« Doma bojo že vedeli. Stekla je proti hišnim durim. Ta pa so bila zaklenjena. Potrkala je na okno in zaklicala: »Janez, je Urška doma?« »Je,« je odgovoril Janez, »v hiši je.« »Moj bog, potlej to nisem jaz,« je rekla vsa prestrašena ter odšla pred druga vrata. Ko pa so ljudje slišali zvončkljanje norčevskih kraguljčkov, ji niso hoteli odpreti in Brihtna Urška ni mogla nikjer najti strehe. Nazadnje je pobegnila iz vasi in je ni videl nihče več. 
",1154
2,Ded_in_vnuk,"Bil je mož, ki je bil star kakor zemlja; oči so mu opešale in se solzile, ušesa so mu oglušela in kolena so se mu tresla. Ko je sedel pri jedi za mizo in komaj držal žlico v roki, se je juha zlivala na prt na mizi in tudi iz ust se mu je kaj pocedilo. Sinu in njegovi ženi se je to gnusilo. Zato sta nazadnje posadila deda v kot za peč, kjer sta mu dajala jesti iz lončene skledice, pa še to ne toliko, da bi se do sitega najedel. Tako je starček ves potrt gledal k mizi in solze so mu tekle iz oči. Nekoč njegove tresoče se roke niso mogle obdržati sklede; padla mu je na tla in se razbila. Mlada žena ga je ozmerjala, on pa ni ničesar rekel in je samo zavzdihnil. Nato mu je za majhen denar kupila leseno skledico in iz nje je moral jesti. Ko so pa nekoč tako sedeli, je mali štiriletni vnuk začel sestavljati na tleh neke deščice. »Kaj boš pa naredil?« ga je vprašal oče. »Majhno koritce,« je odgovoril otrok. »Iz njega bosta jedla mama in ata, ko bom jaz velik.« Tedaj sta se mož in žena za nekaj trenutkov spogledala, nato pa so jima privrele solze iz oči. Nemudoma sta prosila deda, naj sede k njima za mizo. In odslej je moral vedno jesti z njima in tudi nista nič rekla, če se mu je kaj razlilo. 

",240
3,Doktor_vseznalec,"Bil je nekdaj reven kmet, Rak po imenu. Nekega dne je z dvema voloma odpeljal drva v mesto in jih prodal nekemu doktorju. Doktor je ravno sedel pri kosilu, ko je prišel kmet po denar. Kmet je videl, kako doktor lepo je in pije in srce mu je prevzela želja, da bi bil tudi sam doktor. Ko je tako še malo počakal, je nazadnje vprašal, ali bi tudi on lahko postal doktor. »Zakaj pa ne?« je rekel doktor. »To se kaj kmalu lahko zgodi.« »Kaj pa moram storiti?« je vprašal kmet. »Najprej si kupi abecednik, knjigo, ki ima spredaj petelina naslikanega,« ga je doktor začel poučevati. »Drugič: prodaj voz in oba vola in si z denarjem nakupi oblek in vse drugo, kar je potrebno za doktorsko umetnost; tretjič: naroči si tablo z napisom: ,Jaz sem doktor Vseznalec', ter si jo pribij nad hišna vrata.« Kmet je storil vse, kakor mu je bilo naročeno. Ko je tako nekaj časa doktaril, toda ne preveč, se je zgodilo, da so nekemu bogatemu, visokemu gospodu ukradli denar. Ta gospod je zvedel, da živi v tej in tej vasi doktor Vseznalec, ki mora za gotovo vedeti, kam je denar izginil. Zato je dal napreči voz in se odpeljal v tisto vas ter vprašal kmeta, če je on doktor Vseznalec. »Res, to sem jaz,« je rekel krnet. »Pojdite torej z menoj in poiščite ukradeni denar!« 

»Dobro,« je rekel Vseznalec, »a Jera, moja žena, mora tudi z menoj.« Gospod je bil zadovoljen, posadil ju je na voz in vsi trije so se odpeljali. Ko so prišli v plemiški dvorec, je bila miza že pogrnjena in doktor Vseznalec je moral kositi z drugimi vred »Prav, a Jeta, moja žena, tudi,« je rekel in sedel za mizo. Ko je prišel prvi služabnik s skledo dobre jedi, je dregnil krnet svojo ženo in dejal: »Jera, ta je bil prvi!« — misleč pri tem tistega, ki je prinesel prvo jed. Služabnik pa je mislil, .da je hotel reči s tem: »To je bil prvi tat.« In ker je bilo to res, se je ustrašil in je zunaj rekel svojim tovarišem: »Doktor vse ve, slabo jo bomo skupili. Dejal je, da sem bil jaz prvi.« Drugi služabnik se kar ni upal noter, a moral je. Ko je vstopil s svojo skledo v sobo, je kmet dregnil svojo ženo: »Jera, ta je drugi!« Tudi ta služabnik se je hudo prestrašil in se je potrudil, da je bil čimprej zunaj. Tretjemu se ni godilo nič drugače, kajti kmet je rekel svoji ženi: »Jera, ta je tretji!« Četrti je moral prinesti v sobo pokrito skledo in gospod je rekel doktorju, da bi preskusil njegovo umetnost, naj ugane, kaj je v skledi. V njej so bili raki. Kmet je ogledoval skledo in ni vedel, kako bi si pomagal, zato je zamrmral: »Oh, jaz ubogi Rak!« Ko je gospod to slišal, je kriknil: »Glejte ga, res ve, gotovo tudi ve, kdo ima denar.« Služabnik je kar prebledel od groze in je pomežiknil doktorju, naj stopi malo ven. Zunaj so mu vsi štirje priznali, da so ukradli denar, in obljubili, da ga bojo vrnili in mu dali še lepo nagrado povrhu, če jih ne izda, ker bi jim drugače trda predla. Pokazali so mu tudi, kje je denar skrit. 

Doktor je bil zadovoljen s tem, vrnil se je v sobo, sedel za mizo in rekel: »Gospod, zdaj naj še poiščem v tej moji knjigi, kje tiči denar.« Peti služabnik pa se je medtem splazil v peč, da bi slišal, ali ve doktor še kaj več. Ta pa je sedel, odprl svoj abecednik in listal po njem, da bi poiskal petelina. Ko ga pa ni mogel najti, je rekel jezno: »Saj si notri, zato moraš tudi ven.« Tisti v peči pa je mislil, da leti to nanj in je ves prestrašen skočil iz peči ter dejal: »Ta človek vse ve.« Nato je doktor Vseznalec pokazal gospodu, kje je denar, ni pa povedal, kdo ga je ukradel. In tako je od njega in od njih dobil veliko denarja za nagrado in postal nadvse imeniten. 
",673
4,Dvanajst_lovcev,"Bil je nekoč kraljevič, ki se je mudil pri svoji nevesti, ki jo je imel močno rad. Ko je sedel tako pri nji in bil dobre volje, pa je prišlo poročilo, da mu je oče na smrt obolel in da ga želi videti pred smrtjo. Kraljevič je dejal svoji ljubljenki: »Kličejo me in zapustiti te moram. Vzemi tu prstan v spomin name. Ko bom kralj, pridem in te popeljem na svoj dom.« Odjezdil je. Ko je prišel k očetu, je bil ta res na smrt bolan in blizu smrti. »Ljubi moj sin,« mu je rekel, »hotel sem te še enkrat videti pred smrtjo. Obljubi mi, da se boš oženil po moji volji.« Imenoval mu je neko kraljično, s katero se še poznala nista, ki naj bi mu postala žena. Sin pa je bil tako zmeden in potrt, da ni nič pomislil in dejal: »Naj se zgodi, dragi oče, kakor želite.« Nato je kralj zaprl oči in umrl. Ko so oklicali sina za kralja in je minil čas žalovanja, je moral izpolniti obljubo, dano očetu, ter je dal zasnubiti kraljično. Obljubili so mu jo. To pa je zvedela njegova prva nevesta in ta nezvestoba jo je tako strašno razžalostila, da je skoraj umrla od žalosti. To videč ji je oče dejal: »Zakaj si tako žalostna, ljuba hčerka moja? Saj ti dam vse, karkoli si poželiš.« Kraljična je za trenutek pomišljala, nato pa je rekla: »Dragi oče, želim si enajst deklet, ki mi bojo po licu, po postavi in po rasti na las podobne.« 

»Naj se ti izpolni želja, če je mogoče,« je odgovoril kralj. In dal je po vsem kraljestvu tako dolgo iskati, da so našli enajst devic, ki so bile njegovi hčeri po licu, po postavi in po rasti na las podobne. Ko so prišle h kraljični, je ukazala napraviti enajst lovskih oblek, čisto enakih. In dekleta so morala obleči lovske obleke in sama je oblekla dvanajsto. Nato se je poslovila od očeta. Odjahala je s svojim spremstvom in prijahala na dvor svojega prejšnjega ženina, ki ga je tako močno ljubila. Vprašala ga je, ali potrebuje kaj lovcev in ali ne bi kar vseh skupaj sprejel v svojo službo. Mladi kralj si jo je ogledal, a je ni spoznal. Ker pa so bili vsi tako zali ljudje, je pristal, češ da jih rad sprejme. Tako je vseh dvanajst prišlo v kraljevo službo. Kralj pa je imel leva, ki je bil kaj prečudna žival. Znano mu je bilo vse, kar je bilo skritega in tajnega. Zgodilo se je, da je nekega dne lev dejal kralju: »Kralj misli, da ima dvanajst lovcev na dvoru?« »Tako je,« je rekel kralj, »dvanajst lovcev je.« Lev pa je nadaljeval: »Kralj se hudo moti, to je dvanajst deklet.« »Ta je pa bosa,« je vzkliknil kralj, »kako mi moreš dokazati to?« »Kralj naj da posuti svojo predsobo z grahom, pa se bo pr&ej prepričal,« je rekel lev. »Moški imajo čvrst korak in če stopijo na grah, se grašek niti ne zgane, dekleta pa ca-pljajo in plesaje podrsavajo, grah pod nogami pa se začne kotaliti.« Kralju je bil ta nasvet kar všeč in je dal svojo predsobo posuti z grahom. Kralj pa je imel nekega služabnika, ki je bil lovcem naklonjen. Ko je slišal, kakšen poskus bojo napravili z njimi, 

je prišel k njim in jim vse povedal: »Lev hoče natveziti kralju, da ste vsi sama dekleta.« Lepo se mu je zahvalila kraljična, nato pa rekla svojini družicam: »Potrudite se malo in stopajte krepko po grahu.« Ko je dal kralj drugo jutro poklicati lovce k sebi in so te prišle v predsobo, kjer je bil posut grah, so tako krepko stopale po njem in imele tako trden in močan korak, da se niti grašek ni zakotalil ali premaknil. Po njihovem odhodu je rekel kralj levu: »Nalagal si me, saj stopajo kot moški.« »Zvedele so, da jih bo kralj preskušal,« je rekel lev. »Potrudile so se. Kralj naj da postaviti dvanajst kolovratov v predsobo. Ko pridejo, se bojo vse veselo ozrle po njih. In tega moški ne stori.« Kralju je bil nasvet všeč in je dal postaviti kolovrate v predsobo. Služabnik pa, ki je bil za lovce, je šel in razkril kraljevo namero. Kraljična je dejala svojim dekletom, ko so bile same: »Potrudite se malo in se nikar ne ozirajte po kolovratih.« Ko je dal kralj naslednje jutro poklicati svojih dvanajst lovcev, so prišle v predsobo in niti z očesom ni nobena trenila proti kolovratom. Ves jezen je rekel kralj levu: »Spet si me nalagal, to so moški, ker se niti ozrli niso po kolovratih.« »Zvedele so, da jih kralj preskuša,« je odgovoril lev. »Zato so se prisilile.« Kralj pa levu ni več verjel. Dvanajsterica lovcev je kralja stalno spremljala na lovu. Kralj jih je imel vedno rajši. Zgodilo se je, da so bili nekoč na lovu, ko je prišla vest, da prihaja kraljeva nevesta. 

Ko je prva nevesta to slišala, jo je tako silno zabolelo srce, da ji je skoraj počilo. Omedlela je in se zgrudila na tla. Kralj je menil, da se je njegovemu dragemu lovcu kaj pripetilo, skočil je k njemu in mu hotel pomagati ter mu slekel rokavico. Tedaj pa je zapazil prstan, ki ga je bil dal svoji prvi nevesti. In ko jo je pogledal v obraz, jo je spoznal. Bil je tako presunjen, da jo je poljubil. Ko pa je odprla oči, je ginjeno dejal: »Ti si moja in jaz sem tvoj in tega nobena sila in obljuba ne more spremeniti.« Poslal je sla k drugi nevesti in jo prosil, naj se vrne v svojo deželo, ker že ima svojo ljubljeno soprogo in da stara ljubezen nikdar ne zarjavi. Potlej pa so slavili poroko in lev je prišel spet v milost, ker je bil vendarle tisti, ki je govoril resnico. 
",959
