,eng_title,eng_text,eng_text_len,slo_title,slo_text,slo_text_len
0,THE TRAVELLING MUSICIANS,"An honest farmer had once an ass that had been a faithful servant to him
a great many years, but was now growing old and every day more and more
unfit for work. His master therefore was tired of keeping him and
began to think of putting an end to him; but the ass, who saw that some
mischief was in the wind, took himself slyly off, and began his journey
towards the great city, ‘For there,’ thought he, ‘I may turn musician.’

After he had travelled a little way, he spied a dog lying by the
roadside and panting as if he were tired. ‘What makes you pant so, my
friend?’ said the ass. ‘Alas!’ said the dog, ‘my master was going to
knock me on the head, because I am old and weak, and can no longer make
myself useful to him in hunting; so I ran away; but what can I do to
earn my livelihood?’ ‘Hark ye!’ said the ass, ‘I am going to the great
city to turn musician: suppose you go with me, and try what you can
do in the same way?’ The dog said he was willing, and they jogged on
together.

They had not gone far before they saw a cat sitting in the middle of the
road and making a most rueful face. ‘Pray, my good lady,’ said the ass,
‘what’s the matter with you? You look quite out of spirits!’ ‘Ah, me!’
said the cat, ‘how can one be in good spirits when one’s life is in
danger? Because I am beginning to grow old, and had rather lie at my
ease by the fire than run about the house after the mice, my mistress
laid hold of me, and was going to drown me; and though I have been lucky
enough to get away from her, I do not know what I am to live upon.’
‘Oh,’ said the ass, ‘by all means go with us to the great city; you are
a good night singer, and may make your fortune as a musician.’ The cat
was pleased with the thought, and joined the party.

Soon afterwards, as they were passing by a farmyard, they saw a cock
perched upon a gate, and screaming out with all his might and main.
‘Bravo!’ said the ass; ‘upon my word, you make a famous noise; pray what
is all this about?’ ‘Why,’ said the cock, ‘I was just now saying that
we should have fine weather for our washing-day, and yet my mistress and
the cook don’t thank me for my pains, but threaten to cut off my
head tomorrow, and make broth of me for the guests that are coming
on Sunday!’ ‘Heaven forbid!’ said the ass, ‘come with us Master
Chanticleer; it will be better, at any rate, than staying here to have
your head cut off! Besides, who knows? If we care to sing in tune, we
may get up some kind of a concert; so come along with us.’ ‘With all my
heart,’ said the cock: so they all four went on jollily together.

They could not, however, reach the great city the first day; so when
night came on, they went into a wood to sleep. The ass and the dog laid
themselves down under a great tree, and the cat climbed up into the
branches; while the cock, thinking that the higher he sat the safer he
should be, flew up to the very top of the tree, and then, according to
his custom, before he went to sleep, looked out on all sides of him to
see that everything was well. In doing this, he saw afar off something
bright and shining and calling to his companions said, ‘There must be a
house no great way off, for I see a light.’ ‘If that be the case,’ said
the ass, ‘we had better change our quarters, for our lodging is not the
best in the world!’ ‘Besides,’ added the dog, ‘I should not be the
worse for a bone or two, or a bit of meat.’ So they walked off together
towards the spot where Chanticleer had seen the light, and as they drew
near it became larger and brighter, till they at last came close to a
house in which a gang of robbers lived.

The ass, being the tallest of the company, marched up to the window and
peeped in. ‘Well, Donkey,’ said Chanticleer, ‘what do you see?’ ‘What
do I see?’ replied the ass. ‘Why, I see a table spread with all kinds of
good things, and robbers sitting round it making merry.’ ‘That would
be a noble lodging for us,’ said the cock. ‘Yes,’ said the ass, ‘if we
could only get in’; so they consulted together how they should contrive
to get the robbers out; and at last they hit upon a plan. The ass placed
himself upright on his hind legs, with his forefeet resting against the
window; the dog got upon his back; the cat scrambled up to the dog’s
shoulders, and the cock flew up and sat upon the cat’s head. When
all was ready a signal was given, and they began their music. The ass
brayed, the dog barked, the cat mewed, and the cock screamed; and then
they all broke through the window at once, and came tumbling into
the room, amongst the broken glass, with a most hideous clatter! The
robbers, who had been not a little frightened by the opening concert,
had now no doubt that some frightful hobgoblin had broken in upon them,
and scampered away as fast as they could.

The coast once clear, our travellers soon sat down and dispatched what
the robbers had left, with as much eagerness as if they had not expected
to eat again for a month. As soon as they had satisfied themselves, they
put out the lights, and each once more sought out a resting-place to
his own liking. The donkey laid himself down upon a heap of straw in
the yard, the dog stretched himself upon a mat behind the door, the
cat rolled herself up on the hearth before the warm ashes, and the
cock perched upon a beam on the top of the house; and, as they were all
rather tired with their journey, they soon fell asleep.

But about midnight, when the robbers saw from afar that the lights were
out and that all seemed quiet, they began to think that they had been in
too great a hurry to run away; and one of them, who was bolder than
the rest, went to see what was going on. Finding everything still, he
marched into the kitchen, and groped about till he found a match in
order to light a candle; and then, espying the glittering fiery eyes of
the cat, he mistook them for live coals, and held the match to them to
light it. But the cat, not understanding this joke, sprang at his face,
and spat, and scratched at him. This frightened him dreadfully, and away
he ran to the back door; but there the dog jumped up and bit him in the
leg; and as he was crossing over the yard the ass kicked him; and the
cock, who had been awakened by the noise, crowed with all his might. At
this the robber ran back as fast as he could to his comrades, and told
the captain how a horrid witch had got into the house, and had spat at
him and scratched his face with her long bony fingers; how a man with a
knife in his hand had hidden himself behind the door, and stabbed him
in the leg; how a black monster stood in the yard and struck him with a
club, and how the devil had sat upon the top of the house and cried out,
‘Throw the rascal up here!’ After this the robbers never dared to go
back to the house; but the musicians were so pleased with their quarters
that they took up their abode there; and there they are, I dare say, at
this very day.",1368,Bremenski_mestni_godci,"Imel je človek osla, ki je že leta in leta potrpežljivo vlačil vreče žita v mlin. A moči so mu začele pešati, tako da je bil čedalje manj sposoben za delo. In je prišlo gospodarju na misel, da bi ga nehal hraniti. Osel pa je zaduhal, da piha slab veter, pobegnil je in se odpravil v mesto Bremen. Upal je, da bo tam lahko dobil službo mestnega godca. Ko je nekaj časa tako koračil, je naletel na lovskega psa, ki je ležal na poti in sopel, kakor kdo, ki se je do smrti utrudil od tekanja. »Kaj pa tako sopeš, Grabavs?« ga vpraša osel. »Oh,« odvrne pes. »Star sem in vsak dan slabši, niti za lov nisem več. Ker me je gospodar hotel ubiti, sem jo ucvrl, zdaj pa ne vem, kako naj si zaslužim skorjico kruha?« »Veš kaj?« mu odvrne osel. »Jaz sem namenjen v Bremen, da postanem tam mestni godec. Jaz bom igral lutnjo, ti bi pa udarjal na boben.« Pes je bil zadovoljen in je šel z njim. Ni dolgo trajalo, kar sta srečala mačko, ki je čepela na poti in se nadvse kislo in čemerno držala. »Kaj pa ti gre tako narobe, Čohačka stara?« jo je vprašal osel. »Joj, joj, kdo pa bi bil vesel, če se mu grlo stiska?« je rekla mačka. »Ker sem prišla v leta in so se mi zobje skrhali ter rajši za pečjo sedim in predem, kakor pa bi lovila miši, me je hotela gospodinja utopiti. Jaz sem se ji sicer iztrgala, a zdaj mi je potreben dober svet: kam naj grem?« 

»Pojdi z nama v Bremen. Saj si mojster v nočni muziki tam lahko postaneš mestni godec.« Mački se je zdelo to pametno, pa je šla z njima. Nato so begunci prišli mimo nekega dvorišča; pred vrati je stal domači petelin in na vse pretege »Kaj pa se dereš, da reže v mozeg in v kosti?« mu je rekel osel. »Kaj hočeš s tem?« »Prerokoval sem lepo vreme,« je dejal petelin, »ker je jutri praznik in se mora perilo posušiti. Ker pa pridejo jutri gostje, nima gospodinja usmiljenja z menoj in je naročila kuharici, da me bo jutri v juhi pojedla in zato si moram že danes dati odrezati glavo. Zdaj se derem na vse grlo, dokler se še lahko.« »Eh, kaj, Rdečeglavček,« mu reče osel, »pojdi rajši z nami! V Bremen smo namenjeni, kaj boljšega kakor smrt povsod lahko najdeš. Lep glas imaš in če skupaj zaigramo, bo to odlična muzika.« Petelinu je bil predlog všeč in vsi štirje so odšli na pot. Vendar pa v enem dnevu niso mogli priti do mesta Bremen in tako so prišli zvečer v neki gozd, kjer so hoteli prenočiti. Osel in pes sta legla pod visoko drevo, mačka in petelin pa sta se spravila na veje, a petelin je zletel prav do vrha, kjer je bilo zanj najbolj varno. Preden je zaspal, se je še enkrat ozrl na vse štiri strani in zazdelo se mu je, da vidi v daljavi majhno iskrico, zaklical je tovarišem, da mora biti nedaleč od tod neka hiša, v kateri se nekaj svetlika. »Potemtakem se moramo dvigniti,« je rekel osel, »in oditi tja, ker imamo tukaj slabo prenočišče.« Pes je menil, da bi mu malo kosti z mesom ne delo slabo. Tako so se odpravili na pot proti kraju, od koder je prihajal svetloba. Videli so, da je luč čedalje večja, dokler niso prišli 

pred dobro razsvetljeno razbojniko hišo. Osel se je kot največji približal oknu in pogledal v hišo. »Kaj pa vidiš, Sivko?« je vprašal petelin. »Kaj vidim?« je odvrnil osel. »Lepo pogrnjeno mizo vidim • z dobrimi jedmi in pijačami. Okrog mize pa sede razbojniki in se mastijo.« »To bi bilo nekaj za nas,« je dejal petelin. »Saj, saj, oh, če bi bili mi tam notri,« je zavzdihnil osel. Nato so se začele živali posvetovati, kaj naj napravijo, da bi pregnale razbojnike iz hiše. Končno so se domislile. Osel se je moral s prednjimi parklji postaviti na okno, pes skočiti oslu na hrbet, mačka zlesti na psa in nazadnje je zletel petelin kvišku ter sedel mački na glavo. Potem so začeli na dano znamenje vsak svojo pesem: osel je rigal, pes lajal, mačka mijavkala in petelin zakikirikal. Nato so planili skozi okno v izbo, da so zažvenketale šipe. Razbojniki so ob strahovitem vrišču planili na noge, ker so mislili, da je prišla neka prikazen, ter so v silnem strahu pobegnili v gozd. Naši štirje prijatelji pa so sedli za mizo, se zadovoljili s tem, kar je ostalo, ter se tako natlačili, kakor da najmanj štiri tedne ne bojo imeli kaj dati v usta. Ko so se naši štirje godci nasitili, so utrnili luč in si poiskali vsak svoje ležišče, kakor se je komu prileglo in mu bilo pogodu. Osel je legel na gnoj, pes za vrata, mačka na ognjišče k toplemu pepelu in petelin na kurjo gredo. In ker so bili utrujeni od dolge poti, so kmalu tudi zaspali. Ko je minila polnoč in so roparji od daleč videli, da ni več luči v hiši in da je videti vse mirno, je rekel njihov kolovodja: »Ne bi se smeli pustiti tako hitro ugnati v kozji rog.« Poslal je enega razbojnika, naj pogleda in preišče hišo. Vse je bilo tiho. Stopil je v kuhinjo, da bi prižgal svečo. In ker je imel žareče, ognjene mačkine oči za tleče oglje, je primaknil k njim žveplenko, da bi jo prižgal. Mačka pa ni 

poznala šale. Skočila mu je v obraz ter ga začela praskati. Zelo se je razbojnik prestrašil, stekel je in hotel skozi dvoriščna vrata na dvorišče, pes pa, ki je ležal tam, je skočili in ga ugriznil v nogo. In ko je razbojnik oddirjal po dvorišču mimo gnoja, mu je dal še osel pošteno brco z zadnjo nogo. Petelin pa, ki ga je ves hrup prebudil iz spanja, se je zdramil, in na vse grlo zapel z grede: »Kikiriki!« Razbojnik je tekel, kolikor so ga nesle noge, k svojemu poglavarju in mu sporočil: »Hu, v tisti hiši gospodari neka grozovita čarovnica. Puhnila je vame in mi s svojimi dolgimi nohti razpraskala ves obraz. In pred vrati stoji nekdo z nožem, ki me je usekal v nogo, na dvorišču leži neka črna pošast, ki me je oplazila z lesenim betom, na strehi pa je sedel sodnik in vpil: ,Pripeljite mi lopova!' Zato sem pobegnil.« Od takrat si roparji niso več upali v hišo, štirim bremenskim godcem pa je bilo tako všeč v njej, da niso hoteli več ven. In če niso že umrli, živijo še dandanes. ",1088
1,OLD SULTAN,"A shepherd had a faithful dog, called Sultan, who was grown very old,
and had lost all his teeth. And one day when the shepherd and his wife
were standing together before the house the shepherd said, ‘I will shoot
old Sultan tomorrow morning, for he is of no use now.’ But his wife
said, ‘Pray let the poor faithful creature live; he has served us well a
great many years, and we ought to give him a livelihood for the rest of
his days.’ ‘But what can we do with him?’ said the shepherd, ‘he has not
a tooth in his head, and the thieves don’t care for him at all; to
be sure he has served us, but then he did it to earn his livelihood;
tomorrow shall be his last day, depend upon it.’

Poor Sultan, who was lying close by them, heard all that the shepherd
and his wife said to one another, and was very much frightened to think
tomorrow would be his last day; so in the evening he went to his good
friend the wolf, who lived in the wood, and told him all his sorrows,
and how his master meant to kill him in the morning. ‘Make yourself
easy,’ said the wolf, ‘I will give you some good advice. Your master,
you know, goes out every morning very early with his wife into the
field; and they take their little child with them, and lay it down
behind the hedge in the shade while they are at work. Now do you lie
down close by the child, and pretend to be watching it, and I will come
out of the wood and run away with it; you must run after me as fast as
you can, and I will let it drop; then you may carry it back, and they
will think you have saved their child, and will be so thankful to you
that they will take care of you as long as you live.’ The dog liked this
plan very well; and accordingly so it was managed. The wolf ran with the
child a little way; the shepherd and his wife screamed out; but Sultan
soon overtook him, and carried the poor little thing back to his master
and mistress. Then the shepherd patted him on the head, and said, ‘Old
Sultan has saved our child from the wolf, and therefore he shall live
and be well taken care of, and have plenty to eat. Wife, go home, and
give him a good dinner, and let him have my old cushion to sleep on
as long as he lives.’ So from this time forward Sultan had all that he
could wish for.

Soon afterwards the wolf came and wished him joy, and said, ‘Now, my
good fellow, you must tell no tales, but turn your head the other way
when I want to taste one of the old shepherd’s fine fat sheep.’ ‘No,’
said the Sultan; ‘I will be true to my master.’ However, the wolf
thought he was in joke, and came one night to get a dainty morsel. But
Sultan had told his master what the wolf meant to do; so he laid wait
for him behind the barn door, and when the wolf was busy looking out for
a good fat sheep, he had a stout cudgel laid about his back, that combed
his locks for him finely.

Then the wolf was very angry, and called Sultan ‘an old rogue,’ and
swore he would have his revenge. So the next morning the wolf sent the
boar to challenge Sultan to come into the wood to fight the matter. Now
Sultan had nobody he could ask to be his second but the shepherd’s old
three-legged cat; so he took her with him, and as the poor thing limped
along with some trouble, she stuck up her tail straight in the air.

The wolf and the wild boar were first on the ground; and when they
espied their enemies coming, and saw the cat’s long tail standing
straight in the air, they thought she was carrying a sword for Sultan to
fight with; and every time she limped, they thought she was picking up
a stone to throw at them; so they said they should not like this way of
fighting, and the boar lay down behind a bush, and the wolf jumped
up into a tree. Sultan and the cat soon came up, and looked about and
wondered that no one was there. The boar, however, had not quite hidden
himself, for his ears stuck out of the bush; and when he shook one of
them a little, the cat, seeing something move, and thinking it was a
mouse, sprang upon it, and bit and scratched it, so that the boar jumped
up and grunted, and ran away, roaring out, ‘Look up in the tree, there
sits the one who is to blame.’ So they looked up, and espied the wolf
sitting amongst the branches; and they called him a cowardly rascal,
and would not suffer him to come down till he was heartily ashamed of
himself, and had promised to be good friends again with old Sultan.",875,Stari_sultan,"Neki kmet je imel zvestega psa, ki mu je bilo ime Sultan. Pes pa se je postaral in zgubil je vse svoje zobe, tako da ni mogel več krepko zgrabiti. Nekega dne je stal kmet s svojo ženo pred hišnimi vrati in dejal: »Starega Sultana bom jutri ustrelil, ker ni več za rabo.« Ženi pa se je zvesta žival smilila in je rekla: »Toliko let nam je služil in zvesto držal z nami, lahko bi ga iz usmiljenja obdržala.« »Kje neki,« je rekel kmet, »saj si ob pamet. Niti enega zoba nima več, tatovi se ga ne bojijo, lahko ga pogrešamo. Če nam je služil, se je zato vsak dan dobro nažrl.« Ubogi pes, ki je ležal nedaleč od tod zleknjen na soncu, pa je vse to slišal. Žalosten je bil, ker je bil zanj naslednji dan njegov zadnji. Imel pa je dobrega starega znanca, volka, in k temu se je zvečer splazil ter mu potožil usodo, ki ga čaka. »Kar dobre volje bodi, Sultan,« je rekel volk, »jaz ti že pomagam iz stiske. Nekaj sem si izmislil. Jutri odide tvoj gospodar z ženo po seno. S seboj bosta vzela svojega malega otroka, ker ne bo nikogar doma. Navadno položita med delom otroka za seč v senco. Lezi ti zraven otroka, kakor da ga hočeš stražiti. Jaz pa se bom medtem priplazil iz gozda in ugrabil otroka. Ti moraš steči za menoj, kakor da mi ga hočeš iztrgati. Jaz ga bom spustil na tla, ti pa ga boš prinesel staršem nazaj. Mislila bosta, da si ga rešil in ti bosta veliko preveč 

hvaležna, da bi ti storila kaj žalega. Narobe, še v posebni milosti boš in ničesar več ne boš pogrešal.« Ta naklep je bil psu všeč. In kakor sta ga zasnovala, tako sta ga izvedla. Oče je zakričal, ko je zagledal volka, ki je tekel z otrokom, ko ga je pa stari Sultan prinesel nazaj, je bil neznansko vesel. Pobožal je psa in rekel: »Niti lasu ti ne bomo skrivili, obdržali te bomo in jedel boš, dokler boš živ.« Svoji ženi pa je dejal : »Pojdi precej domov in skuhaj staremu Sultanu mlečne kaše, ki je ni treba gristi. In prinesi še blazino z moje postelje, naj jo ima za svoje ležišče.« Od takrat naprej se je staremu Sultanu tako dobro godilo, kot si je le mogel želeti. Kmalu zatem ga je obiskal volk. Bil je vesel, da se je tako lepo posrečilo. »Ampak, Sultan,« je rekel, »saj boš menda zatisnil oko, če vzamem ob priložnosti tvojemu gospodarju kakšno rejeno ovco. Dandanes se je težko prebijati skozi življenje.« »S tem pa rajši ne računaj,« je odgovoril Sultan, »svojemu gospodarju ostanem zvest, v to ne smem privoliti.« Volk je menil, da ni resno govoril; priplazil se je ponoči in hotel ugrabiti ovco. Kmet pa, ki mu je zvesti Sultan izdal, kaj volk namerava, ga je pričakal in mu s cepcem kaj grdo počesal dlako. Volk je moral pobegniti. Spotoma pa je zaklical psu: »Le čakaj, mrcina pasja, to mi boš plačal!« Drugo jutro je volk poslal merjasca, da je pozval Sultana, naj pride v gozd, da bosta z volkom v dvoboju poravnala spor. Stari Sultan ni mogel najti druge priče kakor mačka, ki je imel samo še tri noge. In ko sta šla skupaj v gozd, je ubogi maček šantal, obenem pa zaradi bolečine visoko dvigal svoj rep. 

Volk in njegova priča sta bila že na mestu. Ko pa sta zagledala svojega nasprotnika, ki je prihajal, sta mislila, da prinaša sabljo s seboj, tak je bil videti mačkin dvignjeni rep. In ker je uboga žival poskakovala po treh nogah, sta bila prepričana, da Sultan vsakokrat pobere kak kamen, da ju bo obsul z njim. Tedaj je obema šinil strah v kosti: merjasec se je zaril v listje, volk pa je skočil na drevo. Ko sta pes in maček prišla tja, sta se začudila, da ni nikogar nikjer. Merjasec pa se ni mogel čisto skriti v listje, temveč so mu uhlji še moleli iz njega. Ko se je maček lagodno oziral okrog sebe, je zmignil merjasec z uhlji. Maček pa je mislil, da je švignila miška, skočil je in krepko ugriznil v uho. Merjasec je zarjul od bolečine, planil, stekel in zavpil: »Tamle na drevesu se skriva pravi krivec!« Pes in maček sta pogledala na drevo in opazila volka, ki ga je bilo sram, da se je pokazal takega strahopetca. In volk je sprejel mir, ki mu ga je ponudil Sultan. 
",739
