,slo_title,slo_text,slo_text_len
11,Stirje_izuceni_bratje,"Bil je reven mož, ki je imel štiri sinove. Ko so odrasli, jim je dejal: »Ljubi moji sinovi, po svetu morate, jaz nimam ničesar, kar bi vam dal. Pripravite se in pojdite na tuje, izučite se kakšnega rokodelstva in glejte, kako se boste prebili.« Bratje so vzeli popotne palice v roke, se poslovili od svojega očeta ter odšli skozi mestna vrata. Ko so nekaj časa romali, so prišli do križišča, ki je držalo na štiri različne strani. »Tukaj se moramo ločiti,« je rekel najstarejši, »a čez štiri leta obsorej se spet dobimo. Medtem pa poskusimo svojo srečo.« Tako so ubrali vsak svojo pot. Pa je srečal najstarejšega brata človek, ki ga je vprašal, kam hoče in kaj namerava. »Rokodelstva se grem učit,« je rekel on. »Pojdi z menoj in postani tat!« je rekel človek. »Ne,« je odgovoril brat, »to ni pošteno rokodelstvo. In konec pesmice je zmerom ta, da uporabijo nazadnje človeka kje pod milim nebom za kembelj pri zvonu.« »Kaj še,« je rekel človek, »vislic se ti ni treba bati. Jaz te naučim samo, da dobiš v roke to, česar noben človek ne more dobiti in da ti nihče ne pride na sled.« Dal se je pregovoriti, se izučil za tatu in je postal tako spreten, da ni bilo nič varno pred njim, kar je hotel dobiti. Tudi drugi brat je srečal človeka, ki ga je vprašal, kaj se gre učit. »Saj še sam ne vem,« je rekel ta. 

»Pa pojdi z menoj in postani zvezdogledec. Nič ni boljšega kakor to. Človeku ne ostane nič skritega na svetu.« Temu je bilo to všeč in postal je tako spreten zvezdogledec, da mu je njegov mojster, ko se je izučil in hotel iti dalje, dal daljnogled ter mu rekel: »S tem zagledaš vse, kar se godi na zemlji in na nebu in ti ne more ostati nič skritega.« Tretjega brata je vzel neki lovec v uk in ga tako dobro izučil v vsem, kar spada k lovu, da je postal res dober. Pri slovesu mu je mojster podaril puško in dejal: »Ta ne zgreši nikdar, karkoli vzameš na muho, zanesljivo zadeneš z njo.« Tudi najmlajši brat je srečal človeka, ki ga je nagovoril in vprašal, kaj namerava. »Te ne bi mikalo postati krojač?« ga je vprašal. »Ne mika me,« je odgovoril najmlajši. »Tisto posedanje s krivim hrbtom od jutra do večera, pa tisto šviganje s šivanko, pa tisti likalnik mi še na misel ne pridejo.« »Eh, kaj,« je rekel človek, »govoriš pač, kakor veš. Pri meni bi se izučil čisto drugačne krojaške umetnosti, ki je dostojna in velika in celo zelo častivredna.« Tako se je dal pregovoriti, šel je z njim in se korenito izučil krojaške umetnosti. Pri slovesu mu je dal mojster šivanko in rekel: »S to šivanko lahko sešiješ, karkoli ti pride pod roko, pa če je tako mehko kakor jajce ali pa tako trdo kakor jeklo. In sešito bo kakor en kos, niti šiva ne bo videti.« Ko so minila dogovorjena štiri leta, so se bratje sešli na križišču, kot so se bili zmenili, se prisrčno pozdravili in odšli domov k očetu. »No,« je veselo rekel oče, »vas je spet prinesel veter k meni.« Povedali so mu, kako se jim je godilo in da se je vsakdo izučil svojega rokodelstva. Sedeli pa so ravno pred hišo pod 

visokim drevesom, zato je oče dejal: »Rad bi vas preskusil in videl, kaj znate.« Ozrl se je kvišku in rekel drugemu sinu: »Tamle na vrhu drevesa je med dvema vejama ščinkavčevo gnezdo, povej mi, koliko jajc je v njem?« Zvezdogledec je vzel daljnogled, pogledal tja gor in rekel: »Pet jih je.« Oče je rekel najstarejšemu: »Splezaj in prinesi jajčka, a tako, da ščinkavca, ki sedi na njih in vali, ne boš zmotil pri tem.« Zvedeni tat je splezal na drevo in ptiču, ki ni niti opazil in je mirno sedel dalje, vzel pet jajčk ter jih prinesel očetu. Oče jih je vzel, jih položil na mizo, vsakega v en kot in petega v sredo ter velel lovcu: »Prestreli vseh pet jajčk z enim strelom ravno po sredini.« Lovec je naravnal puško ter prestrelil vseh pet jajčk, kakor je ukazal oče, in sicer z enim samim strelom. Gotovo je imel smodnik, ki strelja okrog vogala. »Zdaj pride vrsta nate,« je rekel oče četrtemu sinu: »Sešij jajčka nazaj, pa tudi mladiče, ki so v njih, in sicer tako, da se jim strel ne bo poznal.« Krojač je storil, kakor je zahteval oče. Ko je končal, je moral tat odnesti jajčka spet nazaj na drevo v gnezdo in jih podložiti ščinkavki tako, da ne bi ničesar zapazila. Ščinkavka jih je zvalila in čez nekaj dni so prilezli mladički iz lupin in imeli tam, kjer jih je krojač šival, rdečo progo okrog vratu. »Res,« je dejal oče. »Reči moram, da niste od muh. Dobro ste porabili svoj čas in se nekaj poštenega izučili. Sam ne vem, komu bi dal prednost. Ko bi le kmalu našli pravo priložnost pokazati svojo umetnost, tedaj bi se ižkazalo.« 

Kmalu zatem je nastala v deželi velika zmeda. Kraljevo hčerko je ugrabil zmaj! Kralj je bil zaradi tega noč in dan v skrbeh. Razglasiti je dal, da jo bo tistemu, ki jo privede nazaj, dal za ženo. Bratje so stopili in se posvetovali: »To je priložnost, ko se lahko izkažemo.« Namenili so oditi skupaj in osvoboditi kraljično. »Kje je, bom kmalu zvedel,« je rekel zvezdogledec. Vzel je svoj daljnogled, pogledal in dejal: »Jo že vidim. Daleč tam zunaj sedi na skali v morju in zraven nje je zmaj, ki. jo straži.« Nato je šel h kralju ter prosil ladjo zase in za svoje brate. Odpeljali so se skupaj na morje do skale, kjer je sedela kraljična. Zmaj pa je ležal v njenem naročju in spal. »Streljati ne smem,« je rekel lovec, »ker bi z zmajem vred ustrelil tudi zalo deklico.« »Torej poskusim jaz svojo umetnost,« je dejal tat. Splazil se je k skali in jo ugrabil zmaju tako tiho in ročno, da ta ni nič opazil in je še naprej smrčal kakor prej. Bratje so vsi veseli odhiteli z njo na ladjo ter zajadrali na odprto morje. Ko pa se je zmaj prebudil in opazil, da ni več kraljične pri njem, je naglo priplaval za njimi ter besno puhal skozi nos. Ko pa se je ravno dvignil nad ladjo in se hotel vreči nanjo, je lovec nastavil puško ter ga ustrelil naravnost v srce. Zmaj je obležal mrtev. Bil pa je tako velik in silen, da je pri padcu raztreščil vso ladjo. Bratje so srečno ujeli še nekaj desk, ki so se jih oklenili in plavali po širokem morju. V tej hudi stiski pa je krojač, ne bodi len, vzel svojo čudežno šivanko, sešil v največji naglici z nekaj velikimi šivi deske drugo k drugi, sedel nanje in zbral j ladijske kose. Nato je sešil še te, da je bila v kratkem času ladja spet dobra za jadranje. In tako so se lahko srečno vrnili domov. 

Ko je kralj spet zagledal svojo hčer, je zavladalo veliko veselje. Bratom pa je dejal: »Eden izmed vas naj jo dobi za ženo, udiočite se sami med 4,eboj.« Tedaj je nastal hud spor med njimi, kajti vsak jo je hotel dobiti zase. Zvezdogledec je rekel: »Če jaz kraljične ne bi bil opazil, bi bile vse vaše umetnosti zaman. Zato je moja.« Tat pa je rekel: »Če bi je jaz ne izmaknil zmaju, bi vam vse nič ne pomagalo! Zato je moja.« Lovec pa: »Saj bi vas bil zmaj s kraljično vred raztrgal, če ga jaz ne hi bil zadel s kroglo. Zato je moja.« Krojač je rekel: »In če vam jaz ne bi bil skrpal ladje, bi bili klavrno utonili. Zato je moja.« Ko je bilo tako, je odločil kralj: »Vsakdo izmed vas ima enako pravico, a ker vsakdo deklice ne more dobiti, je ne bo dobil nobeden izmed vas. Za nagrado pa dam nji in vam vsakemu del kraljestva.« Odločitev  je ugajala bratom in rekli so: »Bolje je tako, kakor pa da bi se sprli.« Tako je dobil vsak en del kraljestva. In živeli so srečni in zadovoljni s svojim očetom še veliko let. ",1351
12,Volk_in_sedem_kozic,"Bila je nekoč stara koza. Imela je sedem mladih kozic, ki jih je imela rada, kakor ima rada mati svoje otroke. Nekega dne je nameravala iti v gozd po malo krme in je sklicala vseh sedem kozic ter jim dejala: »Dragi otroci, jaz moram v gozd. Pazite se volka. Če pride, vas bo vse požrl s kožo in kostmi. Ta malopridnež se večkrat pretvarja, toda po njegovem raskavem glasu in po njegovih črnih šapah ga boste pr&ej spoznali.« »Dragi mati,« so rekle kozice, »saj bomo lepo pazile, brez skrbi greš lahko z doma.« Stara je zameketala in se mirno odpravila na pot. Ni dolgo trajalo, ko je že nekdo potrkal na hišna vrata in zaklical: »Odprite, ljubi otroci, vaša mamica je prišla in je vsakemu nekaj prinesla.« Kozice pa so spoznale po raskavem glasu, da je volk. »Ne bomo ti odprle!« so odgovorile, »ti nisi naša mati, ta ima mil in ljubek glas, tvoj glas pa je osoren. Ti si volk.« Nato je volk odšel h kramarju in si kupil velik kos krede, ter ga pogoltnil, da mu je glas mileje zvenel. Zatem se je vrnil, potrkal na hišne duri in zaklical: »Odprite, ljubi otroci, vaša mati se je vrnila in je vsakemu nekaj prinesla.« Toda volk je položil svojo črno šapo na okno in ko so otroci to opazili, so rekli: »Ne bomo odprli! Naša mati nima tako črnih nog kakor ti. Ti si volk.« 

Nato je stekel volk k peku in zavzdihnil: »Udaril sem se v nogo, namaži mi jo s testom.« In ko mu je pek namazal nogo, je volk stekel k mlinarju in mu dejal: »Nasuj mi bele moke na sapo.« Mlinar je pomislil: »Tale volk bi rad nekoga preslepil,« in se je uprl. Volk pa mu je zagrozil, da ga bo raztrgal, če ne stori tega. Mlinar se je prestrašil in mu natresel bele moke na šapo. Saj, taki so ljudje! Zdaj je šel malopridnež tretjič k hišnim vratom, potrkal in nežno dejal: »Odprite, otročički! Vaša mamica je prišla domov in je vsakemu nekaj prinesla iz gozda.« Kozice so zaklicale: »Pokaži nam najprej svojo šapo, da bomo vedele, če si res naša draga mamica.« Volk je položil šapo na okno in ko so videle, da je bela, so mislile, da je vse res, kar je dejal, in so odprle vrata. In kdo je vstopil? Volk! Hudo so se prestrašile in so se hotele poskriti. Ena je skočila pod mizo, druga v posteljo, tretja v peč, četrta v kuhinjo, peta v omaro, šesta pod umivalnik, sedma v omarico stenske ure. Volk pa jih je našel, vse, in jih brez pomisleka drugo za drugo požrl; edino najmlajše, tiste v novi omarici, ni našel. Ko si je volk potešil svojo lakoto, je odšel, legel na travo pod drevo in zaspal. Kmalu zatem se vrne stara koza iz gozda. Ah, kakšna slika se je prikazala njenim. očem! Hišne duri nastežaj odprte, miza, stoli in klopi prevrnjeni, skleda za umivanje je bila iv črepinjah, odeja in blazine so bile vse razmetane. Začela je iskati svoje otroke, a nikjer jih ni bilo. Klicala jih je po vrsti z imeni, a nobena se ji ni oglasila. Nazadnje šele, ko je poklicala najmlajšo, je zaklical droben glasek: »Mamica, tukaj sem, v omarici za uro.« 

Rešila je kozico iz omarice in ta ji je povedala, da je prišel volk in vse druge požrl. Lahko si mislite, kako se je koza jokala zaradi svojih ubogih otrok. svoji veliki žalosti je naposled odšla iz hiše in najmlajša kozica je stekla za njo. Na travniku je zagledala volka, ki je ležal pod drevesom in smrčal, da so se kar veje tresle. Začela ga je z vseh strani ogledovati in je videla, da se mu v napihnjenem trebuhu nekaj giblje in cepeta. »Mili bog,« je pomislila, »kaj če so moji ubogi otroci, ki jih je požrl, še pri življenju?« Pri priči je morala mlada kozica steči domov in prinesti škarje, šivanko in sukanec. Potem je stara zverini razparala polni trebuh in komaj je zarezala, že je pokukala iz njega glava mlade kozice. Ko je dalje rezala, je poskakalo iz njega vseh šestero kozic in bile so še vse žive in nepoškodovane. Zver jih je namreč v svoji požrešnosti kar cele pogoltnila. To vam je bilo veselje! Objemale so svojo drago mamico in poskakovale kakor krojaček na svatbi. Mati je dejala: »Pojdite zdaj in prinesite nekaj velikih kamnov, da bomo z njimi tej hudobni živali napolnile trebuh, dokler še spi in smrči.« In vseh sedem kozic je hitro privleklo kamenje, ki so ga stlačile volku v trebuh, kolikor ga je le šlo vanj. Nato ga je stara spet hitro zašila, da ni ničesar opazil in se niti zganil ni. Ko se je volk končno naspal, se je skobacal na noge in ker ga je kamenje v želodcu tako hudo žejalo, je hotel piti iz bliž-njega vodnjaka. Ko pa je začel stopati in se premikati, se je zadevalo kamenje v njegovem trebuhu in trkalo drug ob dru-gega. In volk je jezno zarenčal: »Kaj tako se po trebuhu mi z ropotom kotali? Šest kozličev sem požrl, zdaj kot kamen so težki.« 

Ko je prišel do vodnjaka in se nagnil nad vodo, da bi pil, so ga težki kamni potegnili vanjo. Štrbunknil je v vodnjak in klavrno utonil. Ko so kozice to videle, so pritekle in na ves glas zavriskale: »Volk je mrtev, volk je mrtev!« In od veselja so s svojo mamico zaplesale okrog vodnjaka. 
",907
