,slo_title,slo_text,slo_text_len
7,Pes_in_vrabec,"Neki ovčarski pes ni imel dobrega gospodarja, ampak tako slabega, da je stradal pri njem. Ko ni mogel več vzdržati, je odšel ves žalosten po svetu. Na cesti ga je srečal vrabec in ga vprašal: »Kaj pa ti je, bratec kosmati, da si tako žalosten?« »Lačen sem,« je rekel pes, »in nimam kaj jesti.« »Pojdi z menoj, brate, v mesto, pa se boš nasitil,« je dejal vrabec. Tako sta šla skupaj v mesto in ko sta prišla pred mesnico, je vrabec dejal psu: »Ostani tukaj, odkljuval ti bom kos mesa.« In zletel je na mizo, pogledal okrog sebe, ali ga kdo vidi ter začel kljuvati kos mesa in ga vleči sem in tja, dokler ni kos, ki je ležal na robu, zdrsnil in padel na tla. Pes ga je pograbil, stekel v kot in ga požrl. »Pojdiva zdaj v drugo mesnico,« je rekel vrabec, »poskrbel ti bom še en kos, da se boš do sitega najedel.« Ko je pes pogoltnil tudi drugi kos, ga je vrabec vprašal: »Bratec, si zdaj sit?« »Mesa sem sit,« je odgovoril pes, »a kruha še nisem dobil.« »Tudi kruha dobiš, kar z menoj pojdi.« Vrabec ga je odvedel v pekarno in je začel kljuvati tam, dokler se ni skotalilo nekaj hlebčkov na tla. In ko je pes želel še več, ga je povedel še v drugo pekarno in mu priskrbel še kruh. Ko je pes požrl, ga je vprašal: »Bratec kosmatin, si zdaj sit?« »Sem,« je odgovoril pes, »zdaj pa pojdiva malo iz mesta.« 

In odšla sta iz mesta na glavno cesto. Bilo pa je zelo vroče in ko sta prehodila košček poti, je pes dejal: »Truden sem in rad bi malo zaspal.« »No, kar zaspi, jaz pa sedem ta čas na vejico.« Pes je legel sredi ceste in trdno zaspal. Ko pa je ležal tam in spal, je pripeljal po cesti voznik z vozom, v katerega so bili vpreženi trije konji. Na vozu sta bila dva soda vina. Ko je vrabec videl, da se voznik noče umakniti in da vozi kar po kolovozu, kjer je ležal pes, mu je vzkliknil: »Nikar tega, voznik, nesrečnega te bom storil!« »Ti me že ne boš storil nesrečnega,« je zagodrnjal voznik predse, počil z bičem in pognal voz čez psa, da ga je povozil. »Povozil si mi brata kosmatina,« je zavpil tedaj vrabec, »to boš plačal z vozom in s konji.« »Saj, z vozom in s konji,« je posmehljivo rekel voznik, »kje bi mi mogel ti škodovati.« Voznik je peljal dalje, vrabec pa je zlezel pod ponjavo na vozu ter začel kljuvati čep na sodu in je kljuval tako dolgo, da ga je prekljuval in je steklo vse vino iz soda, ne da bi bil voznik kaj opazil. Ko pa je le pogledal nazaj, je videl, da kaplja z voza; pregledal je sode in — eden je bil prazen. »o, jaz nesrečnež!« je zatarnal. »Nisi še zadosti nesrečen!« je odgovoril vrabec in poletel konju na glavo ter mu izkljuval oči. Ko voznik to vidi, potegne sekiro, da bi zadel vrabca z njo, vrabec pa je odletel v zrak in voznik je zadel svojega konja po glavi, da se je mrtev zgrudil. »Oj, jaz nesrečnež!« je zastokal voznik. »Ne, nisi še zadosti nesrečen!« je dejal vrabec. In ko je voznik z dvema konjema peljal dalje, je vrabec zlezel pod ponjavo in izkljuval čep še pri drugem sodu, da je vse izteklo iz njega. 

Ko voznik to opazi, znova zastoka: »Joj, jaz nesrečnež!« »Nisi še zadosti nesrečen!« mu odgovori vrabec, sede drugemu konju na glavo in mu izkljuje oči. Voznik skoči k njemu in zamahne s sekiro po njem, vrabec pa sfrči kvišku in voznik zadene konja in ga ubije. »Joj, jaz nesrečnež!« »Nisi še zadosti nesrečen,« reče vrabec, sede še tretjemu konju na glavo in začne kljuvati oči. Voznik pa je kakor slep od jeze zamahnil proti vrabcu, ne da bi pazil, a ga ni zadel, marveč je ubil še svojega tretjega konja. »Jojmene, kako sem nesrečen!« zakriči voznik. »Ne, nisi še zadosti nesrečen, onesrečil te bom šele doma,« zagrozi vrabec in odleti. Voznik je moral pustiti voz na cesti in hud in jezen oditi domov. »Ah,« je rekel svoji ženi, »glej kakšna nesreča me je doletela! Vino mi je izteklo iz sodov in vsi trije konji so mrtvi.« »Oh, mož,« je rekla žena možu, »kakšen hudoben ptič je prišel v hišo! Zbral je vse ptice sveta in so se vrgli gori na našo pšenico in bojo vso pozobali.« Voznik je odšel na podstrešje, tam pa je sedelo na tisoče in tisoče ptic in pozobale so vso pšenico; med njimi je bil tudi vrabec. »Joj, kako sem nesrečen!« je ves potrt zavzdihnil voznik. »Ne, nisi še zadosti nesrečen, še s svojim življenjem boš plačal,« je vzkliknil vrabec in odfrčal. Tako je voznik izgubil vse svoje imetje. Žalosten je odšel v hišo, sedel za peč in bil hud in razkačen. Pred oknom pa je sedel vrabec in mu vreščal: »Plačal boš s svojim življenjem!« Voznik je pograbil sekiro in jo zalučal v vrabca; sekira je razbila šipe v oknih, ptice pa ni zadela. Vrabec je priletel nato v izbo, sedel na peč in vreščal: »Plačal boš s svojim življenjem!« 

Voznik pa, ves besen in slep od togote, je razbil peč in tako še vse drugo, kamor koli je sedel vrabec, iz kraja v kraj, vse svoje pohištvo, zrcalo, klopi, mizo in nazadnje še stene svoje hiše, njega pa ni mogel zadeti. Nazadnje ga le pograbi z roko. »Ali naj ga ubijem?« vpraša njegova žena. »Ne,« vzklikne on, »to bi bila premila kazen. Hujše smrti naj umre, požrl ga bom!« Vzel je ptiča in ga pogoltnil. Vrabec pa mu začne frfotati v želodcu, prifrfota kvišku, vozniku v usta. Tam pokuka z glavo ven in zakliče: »Pa boš vendarle plačal z življenjem!« Voznik da sekiro svoji ženi in ji reče: »Ubij mi vrabca v ustih!« Žena udari, udarec pa je zgrešil in zadel voznika naravnost na glavo, da se je mrtev zgrudil na tla. Vrabec pa se je dvignil in odletel. 
",998
8,Rdeca_kapica,"Bila je nekoč majhna, srčkana deklica, ki jo je vsakdo vzljubil, če ga je le pogledala. Najrajši pa jo je imela njena babica. Ta sploh ni vedela, kaj vse bi ji dala. Nekoč ji je podarila kapico iz rdečega žameta. Ker ji je tako ljubko pristajala in ker tudi sama ni hotela nositi nič drugega več, so ji rekli kar Rdeča kapica. Nekega dne ji je rekla mama: »Rdeča kapica, na kos pogače in steklenico vina in nesi to naši babici. Babica je bolna in slaba in to ji bo dobro delo. Pokrepčalo jo bo. Le hitro se odpravi, da ne bo prevroče. In ko prideš v gozd, hodi lepo naravnost in ne tekaj po stranskih stezah, da ne boš padla in razbila steklenice, tako bi babica ničesar ne dobila. In ko vstopiš v sobo, ne pozabi voščiti dobro jutro in ne kukaj prej po vseh kotih in kotičkih.« »Vse bom napravila lepo v redu, kakor je treba,« je rekla Rdeča kapica in dala mami roko. Babica pa je imela hišico dve uri daleč od vasi, sredi nekega gozda. Ko je Rdeča kapica prišla v hosto, je srečala volka. Ker ni vedela, kakšna huda zver je to, se ga ni bala. »Dobro jutro, Rdeča kapica,« jo je nagovoril volk. »Dobro jutro, volk.« »Kam pa že tako zgodaj, Rdeča kapica?« »K babici sem namenjena.« »Kaj pa imaš v košarici?« 

»Kos pogače in steklenico vina. Včeraj smo pekli, pa naj se babica, ki je bolna in slaba, malo posladka in Pokrepča s tem.« »Rdeča kapica, kje pa stanuje tvoja babica?« »Kakšne četrt ure je še. čisto vgozdt' pod tremi visokimi hrasti je njena hišica. Okrog je leskovanileja z lešniki, saj jo gotovo poznaš,« mu je razložila Rdeča kapica. »Mhm, ta mlada, rahla stvarcam je pomislil volk sam pri sebi, »to bo masten prigrizek, ki bo še veliko bolje teknil kakor stara. Lepo zvito se je treba lotiti, pa bom obe pohrustal.« Stopal je nekaj časa vštric Rdeče kapice, nato pa je glasno dejal: »Poglej no, Rdeča kapica, tele lepe cvetke, ki rastejo vsepovsod ob poti. Zakaj si jih malo ne ogledaš? Mislim, da niti ne slišiš, kako milo prepevajo ptičke? Tako zamišljeno hodiš po stezi, kakor bi šla v šolo. Pa je vendar vse tako veselo in zanimivo tu v gozdu.« Rdeča kapica je pogledala okrog sebe. Ko je videla, kako poplesavajo sončni žarki skozi drevje in kako je vseokrog polno lepih cvetic, je pomislila: »Če natrgam šopek cvetlic za babico, jih bo gotovo zelo vesela. Zgodaj je pa še tudi in bom še pravi čas prišla k njej.« Stekla je s poti v gozd in začela trgati cvetlice. In ko je katero odtrgala, se ji je zazdelo, da je malo bolj stran še ena lepša. Stekla je k njej in je bila tako čedalje globlje v gozdu. Volk pa jo je medtem ubral naravnost proti babičini hišici. Ko je prišel tja, je potrkal na vrata. »Kdo pa je zunaj?« je vprašala babica s šibkim glasom. »Rdeča kapica. Prinesla sem ti pogače in vina, odpri mi.« »Kar na kljuko pritisni,« je odgovorila babica. »Preveč sem slaba in ne morem vstati.« Volk je pritisnil na kljuko, vrata so se odprla. On pa je šel, ne da bi bil kaj zinil, naravnost k postelji in požrl babico. 

Nato si je oblekel njeno obleko, posadil na glavo njeno čepico, legel v njeno posteljo ter zagrnil zaveso. Rdeča kapica pa je tekala za cvetlicami. Ko jih je toliko nabrala, da jih ni mogla več nositi, se je spet spomnila babice in odpravila se je k njej. Začudila se je, da so bila vrata odprta. In ko je vstopila, jo je tako čudno spreletelo, da je pomislila: »Jej, kako tesno mi je danes pri srcu. Pa sem bila drugače zmerom tako rada pri babici.« Zavzdihnila je in rekla glasno: »Dobro jutro.« Odgovora pa ni bilo. Zato je stopila k postelji in odgrnila zavese. Pred njo je ležala babica, s čepico, ki jo je imela potisnjeno globoko na obraz. In tako čudna je bila videti. »Joj, babica, kako velika ušesa imaš!« »Da te lahko bolje slišim.« »Joj, babica, kako velike oči imaš!« »Da te lahko bolje vidim.« »Joj, babica, kako velike roke imaš!« »Da te lahko bolje zgrabim.« »Jojmene, babica, kako grozno velika usta imaš!« »Da te lahko bolje požrem!« Volk je zarenčal, bil v skoku iz postelje in požrl ubogo Rdečo kapico. Ko je volk tako nasitil svoj pohlep, je legel spet nazaj v posteljo, zaspal in pričel smrčati, da je kar odmevalo po hiši. Pa je prišel mimo hiše lovec, slišal to in začudeno pomislil: »Kako smrči stara žena. Moram pogledati, če se ji ni kaj zgodilo.« Stopil je v sobo, in ko je prišel do postelje, je videl, da leži volk v njej. »Ha, tukaj sem te našel, mrcina stara!« je vzkliknil. »Že dolgo sem te iskal.« 

Že je hotel nameriti, da bi ustrelil, kar se je domislil, da je volk nemara požrl babico in da bi jo mogoče še lahko rešil. Zato je vzel škarje in začel spečemu volku parati trebuh. Ko je prerezal kožo, je zagledal Rdečo kapico, ko pa je še malo globlje razparal, je skočila deklica iz trebuha. »Hu, kako me je bilo strah!« je vzkliknila. »Tako temno je bilo v volkovem trebuhu!« Nato je prišla ven tudi stara babica, še živa, in je komaj še dihala. Rdeča kapica pa je hitro prinesla nekaj debelih kamnov, ki so jih stlačili volku v trebuh. Ko se je volk malo prebudil, je hotel pobegniti. Kamni pa so bili tako težki, da je kar omahnil in padel mrtev na tla. Vsi trije so bili Zidane volje. Lovec je odrl volku kožo in odšel z njo domov. Babica je pojedla pogačo in popila vino, ki ga je Rdeča kapica prinesla, ter si spet opomogla. Rdeča kapica pa je resno premišljevala: »Nikdar več ne smeš uhajati s poti in sama tekati po gozdu, če ti je mama prepovedala. Kako hudo bi bilo ubogi mami, če bi jaz ostala v volkovem trebuhu!« 
",995
9,Spicparkeljc,"Bil je nekoč mlinar, ki je bil reven, a je imel zalo hčer. Zgodilo se je, da se je nekega dne zapletel s kraljem v pogovor in da bi se pokazal imenitnega, mu je rekel: »Hčer imam, ki zna iz slame presti zlato.« »Oho!« se je začudil kralj. »To je pa umetnost, ki mi je všeč! Če je tvoja hči res tako spretna, kakor praviš, jo pripelji jutri na moj grad. Preskusil jo bom.« Kmet je privedel dekle na grad. Tam so jo odpeljali v izbo, ki je bila polna slame. Kralj ji je dal kolo in vreteno in ji rekel: »Sedi zdaj lepo k delu in če do jutri zjutraj ne spredeš iz te slame zlata, moraš umreti.« Nato je zaklenil izbo, dekle pa je ostalo samo v njej. Tako je sedela tam uboga mlinarjeva hči in si ni znala pomagati. Saj niti pojma ni imela, kako naj bi spredla iz slame zlato. Vedno bolj strah jo je postajalo, tako da je začela nazadnje bridko jokati. Tedaj so se naenkrat odprla vrata in v izbo je stopil čuden majhen možic ter dejal: »Dober večer, mlinarica mlada, kaj pa tako bridko jokaš?« »Oh, oh!« je zajokalo dekle. »Iz slame bi morala spresti zlato, pa ne znam tega.« »Kaj mi daš, če ti ga jaz spredem?« je vprašal možic. »Tole svojo ogrlico,« je reklo dekle. Možiček je vzel ogrlico, sedel h kolesu in drrr drrr drrr, trikrat potegnil, pa je bil vitel poln. Nato je nataknil drugega, in drrr drrr drrr, trikrat potegnil, pa je bil tudi drugi vitel poln. 

Tako je šlo tja do jutra, in že je bila spredena vsa slama in vsi vitli so bili polni zlata. Ob sončnem vzhodu je že prišel kralj. Ko je zagledal zlato, se je močno začudil, srce pa mu je bilo le še pohlepnejše po zlatu. Dal je odpeljati mlinarjevo hčer v drugo izbo s slamo, ki je bila še veliko večja. Ukazal ji je, naj slamo tudi v tej noči sprede v zlato, če ji je življenje drago. Dekle si ni vedelo pomagati in je bridko jokalo. Tedaj so se spet odprla vrata. Prišel je mali možic in dejal: »Kaj mi daš, če ti spredem slamo v zlato?« »Tale svoj prstanček s prsta,« je odgovorilo dekle. Možic je vzel prstan, pognal je kolovrat in je do jutra spredel vso slamo v bleščeče zlato. Kralj se je ob pogledu nanj nadvse razveselil. Njegovo srce pa še ni bilo sito zlata. Velel je odvesti mlinarjevo hčer v še večjo izbo, polno slame. »Še tole moraš spresti nocojšnjo noč,« ji je rekel. »Če se ti posreči, postaneš moja soproga.« Kaj zato, je pomislil, če je mlinarjeva hči, bogatejše žene zlepa ne dobim na vsem svetu. Ko je bilo dekle samo, je še tretjič prišel možic in jo vprašal: »Kaj mi daš, če ti še tokrat spredem siamo?« »Ničesar več nimam, kar bi ti lahko dala,« je odgovorilo dekle. »Pa mi obljubi svojega prvega otroka, ko boš kraljica.« Kdo ve, kaj bo še iz tega, je pomislila mlinarjeva hči, in si tudi iz te stiske ni znala drugače pomagati, kot da je obljubila možicu, kar je zahteval. In zato ji je še enkrat spredel vso slamo v zlato. Zjutraj je prišel kralj in je našel vse tako, kakor je želel. Bil je mož-beseda in se je res oženil z dekletom. In zala mlinarjeva hči je postala kraljica. 

Čez leto dni je povila lepega otročička in ni več mislila na tistega tujega možička. Ta pa je vstopil in dejal: »Zdaj mi daj, kar si mi obljubila.« Kraljica se je prestrašila in je ponudila možicu bogastvo vse dežele, če ji hoče pustiti otroka. Možic pa je dejal: »Ne, živa stvar mi je ljubša kakor vsi zakladi sveta.« Tedaj je začela kraljica tako presunljivo tarnati in jokati, da se je možicu zasmilila: »Tri dni ti dam časa,« ji je rekel, »če zveš moje ime, lahko obdržiš otroka.« Kraljica je vso noč premišljevala o vseh mogočih imenih, ki jih je kdaj slišala. Po vsej deželi je razposlala sle, da bi poizvedeli daleč naokrog, kakšna imena še obstajajo. Ko je možic drugo jutro prišel, je začela z Gašperjem, Mihom in Boltežarjem ter mu imenovala vsa imena po vrsti. Možic pa je ob vsakem dejal: »Ne, tako mi ni ime.« Drugi dan je poslala sle še dlje v deželo, da bi poizvedeli kako se ljudje imenujejo. In možicu je naštevala najbolj nenavadna in najbolj čudna imena: »Ali se pišeš nemara Rebrce ali Koštrunovo bedrce ali Zadrga?« Možic pa je odgovarjal samo: »Ne, tako mi ni ime.« Tretji dan pa je eden od slov pripovedoval takole: »Za nobeno novo ime nisem več zvedel. Pač pa sem prišel na visokem hribu v neko gozdno zakotje, tja, kjer si lisica in zajec voščita lahko noč. Zagledal sem majhno hišico. Pred hišico je gorel ogenj in okrog ognja je plesal prečuden smešen možic, poskakoval na eni nogi in pel: Danes pečem, jutri smodim, pojutrišnjem pa kraljička dobim; 

to je dobro, to je dobro, da nihče ne ve, da mi je Špicparkeljc ime.« Lahko si mislite, kako je bila kraljica vesela, ko je to slišala. Drugo jutro je prišel možic in vprašal: »No, gospa kraljica, kako mi je ime?« Kraljica pa ga je za šalo najprej vprašala: »Ali si morebiti Urh?« »Nisem.« »Ali pa morda Jur?« »Nak.« »Kaj pa če si nemara Špicparkeljc?« je nazadnje vprašala s posebnim poudarkom. Možic je kar pozelenel od jeze: »To ti je povedal sam hudič, to ti je povedal sam hudič!« In od jeze je udaril z levo nogo tako globoko v zemljo, da se je do pol života pogreznil vanjo. Nato pa je v svoji togoti zgrabil z obema rokama svojo levo nogo in sam sebe na dvoje preklal. ",951
10,Stari_sultan,"Neki kmet je imel zvestega psa, ki mu je bilo ime Sultan. Pes pa se je postaral in zgubil je vse svoje zobe, tako da ni mogel več krepko zgrabiti. Nekega dne je stal kmet s svojo ženo pred hišnimi vrati in dejal: »Starega Sultana bom jutri ustrelil, ker ni več za rabo.« Ženi pa se je zvesta žival smilila in je rekla: »Toliko let nam je služil in zvesto držal z nami, lahko bi ga iz usmiljenja obdržala.« »Kje neki,« je rekel kmet, »saj si ob pamet. Niti enega zoba nima več, tatovi se ga ne bojijo, lahko ga pogrešamo. Če nam je služil, se je zato vsak dan dobro nažrl.« Ubogi pes, ki je ležal nedaleč od tod zleknjen na soncu, pa je vse to slišal. Žalosten je bil, ker je bil zanj naslednji dan njegov zadnji. Imel pa je dobrega starega znanca, volka, in k temu se je zvečer splazil ter mu potožil usodo, ki ga čaka. »Kar dobre volje bodi, Sultan,« je rekel volk, »jaz ti že pomagam iz stiske. Nekaj sem si izmislil. Jutri odide tvoj gospodar z ženo po seno. S seboj bosta vzela svojega malega otroka, ker ne bo nikogar doma. Navadno položita med delom otroka za seč v senco. Lezi ti zraven otroka, kakor da ga hočeš stražiti. Jaz pa se bom medtem priplazil iz gozda in ugrabil otroka. Ti moraš steči za menoj, kakor da mi ga hočeš iztrgati. Jaz ga bom spustil na tla, ti pa ga boš prinesel staršem nazaj. Mislila bosta, da si ga rešil in ti bosta veliko preveč 

hvaležna, da bi ti storila kaj žalega. Narobe, še v posebni milosti boš in ničesar več ne boš pogrešal.« Ta naklep je bil psu všeč. In kakor sta ga zasnovala, tako sta ga izvedla. Oče je zakričal, ko je zagledal volka, ki je tekel z otrokom, ko ga je pa stari Sultan prinesel nazaj, je bil neznansko vesel. Pobožal je psa in rekel: »Niti lasu ti ne bomo skrivili, obdržali te bomo in jedel boš, dokler boš živ.« Svoji ženi pa je dejal : »Pojdi precej domov in skuhaj staremu Sultanu mlečne kaše, ki je ni treba gristi. In prinesi še blazino z moje postelje, naj jo ima za svoje ležišče.« Od takrat naprej se je staremu Sultanu tako dobro godilo, kot si je le mogel želeti. Kmalu zatem ga je obiskal volk. Bil je vesel, da se je tako lepo posrečilo. »Ampak, Sultan,« je rekel, »saj boš menda zatisnil oko, če vzamem ob priložnosti tvojemu gospodarju kakšno rejeno ovco. Dandanes se je težko prebijati skozi življenje.« »S tem pa rajši ne računaj,« je odgovoril Sultan, »svojemu gospodarju ostanem zvest, v to ne smem privoliti.« Volk je menil, da ni resno govoril; priplazil se je ponoči in hotel ugrabiti ovco. Kmet pa, ki mu je zvesti Sultan izdal, kaj volk namerava, ga je pričakal in mu s cepcem kaj grdo počesal dlako. Volk je moral pobegniti. Spotoma pa je zaklical psu: »Le čakaj, mrcina pasja, to mi boš plačal!« Drugo jutro je volk poslal merjasca, da je pozval Sultana, naj pride v gozd, da bosta z volkom v dvoboju poravnala spor. Stari Sultan ni mogel najti druge priče kakor mačka, ki je imel samo še tri noge. In ko sta šla skupaj v gozd, je ubogi maček šantal, obenem pa zaradi bolečine visoko dvigal svoj rep. 

Volk in njegova priča sta bila že na mestu. Ko pa sta zagledala svojega nasprotnika, ki je prihajal, sta mislila, da prinaša sabljo s seboj, tak je bil videti mačkin dvignjeni rep. In ker je uboga žival poskakovala po treh nogah, sta bila prepričana, da Sultan vsakokrat pobere kak kamen, da ju bo obsul z njim. Tedaj je obema šinil strah v kosti: merjasec se je zaril v listje, volk pa je skočil na drevo. Ko sta pes in maček prišla tja, sta se začudila, da ni nikogar nikjer. Merjasec pa se ni mogel čisto skriti v listje, temveč so mu uhlji še moleli iz njega. Ko se je maček lagodno oziral okrog sebe, je zmignil merjasec z uhlji. Maček pa je mislil, da je švignila miška, skočil je in krepko ugriznil v uho. Merjasec je zarjul od bolečine, planil, stekel in zavpil: »Tamle na drevesu se skriva pravi krivec!« Pes in maček sta pogledala na drevo in opazila volka, ki ga je bilo sram, da se je pokazal takega strahopetca. In volk je sprejel mir, ki mu ga je ponudil Sultan. 
",739
