,slo_title,slo_text,slo_text_len
5,Janko_in_Metka,"Na robu nekega velikega gozda je živel reven drvar s svojo ženo in z dvema otrokoma. Fantku je bilo ime Janko in dekletcu Metka. Drvarjeva družina že tako ni imela kdo ve kaj jesti, ko pa je nastopilo nerodovitno leto, ni mogel drvar zaslužiti niti vsakdanjega kruha. Ko je tako ponoči premišljeval v svoji postelji in se od skrbi premetaval, je vzdihnil in dejal svoji ženi: »Kaj bo z nami? Kako naj preživiva svoja uboga otroka, ko še zase nimava ničesar več?« »Veš kaj, mož,« je odgovorila žena, »jutri navsezgodaj od- peljiva otroka v gozd v najgostejšo goščo. Tam zakuriva ogenj in dajva vsakemu še košček kruha, nato pa se odpraviva na svoje delo in ju pustiva sama. Tako ne bosta več našla poti domov in se jih bova odkrižala.« »Ne, žena,« je rekel mož, »tega ne bom storil. Srce mi ne da, da bi puščal otroka sama v gozdu. Saj pridejo divje zveri in ju raztrgajo.« »O, ti bedak,« je rekla na to žena, »po tvojem naj potemtakem vsi štirje od lakote umremo. Ostane nam samo to, da izoblaš deske za mrtvaške krste.« In mu ni dala miru, dokler ni pristal. »Uboga otroka pa se mi vseeno smilita!« je dejal mož. Tudi lačna otroka nista mogla zaspati in sta slišala, kaj je mačeha rekla očetu. Metka je bridko zajokala in rekla Janku: »To je najin konec!«
»Tiho, Metka,« je rekel Janko, »nič ne skrbi, jaz si bom že kaj izmislil za naju.« In ko sta stara dva zaspala, je vstal, oblekel svoj suknjič, odprl zunanja vrata in se splazil ven. Mesec je jasno svetil in belo kamenje, ki je ležalo pred kočo, je sijalo kakor sami srebrniki. Janko se je sklonil in si vse žepe natlačil s kamenčki. Nato je šel nazaj v hišo in dejal Metki: »Nič ne skrbi, draga sestrica, kar mirno zaspi, vse bo še dobro.« In je legel nazaj v svojo posteljo. Zgodaj zjutraj, še preden je vzšlo sonce, je že prišla mačeha in zbudila otroka: »Vstanita, lenuha, v gozd grerilo po drva.« Nato je dala vsakemu košček kruha in rekla: »Tu imata nekaj za kosilo, a ne pojejta takoj, ker ne dobita nič drugega.« Metka je dala kruh pod prepasnik, ker je imel Janko vse žepe natlačene s kamenčki. Nato so se vsi štirje odpravili na pot proti gozdu. Ko so že nekaj časa hodili, se je Janko ustavil in se oziral nazaj proti hiši. Tako se je ustavljal in oziral venomer. »Kaj pa se kar naprej ustavljaš in zijaš nazaj, Janko? Pazi in ne pozabi na svoje noge,« je rekel oče. »Oh, oče,« je dejal deček, »po svoji beli mucki se oziram. Ta sedi na strehi in se poslavlja od mene.« »Bedak,« je rekla mati, »to ni tvoja bela mačka, to je jutranje sonce, ki sije na dimnik.« Janko pa se ni oziral po mački, temveč je vsakič vrgel na pot po en svetal kamenček iz žepa. Ko so prišli v sredo gozda, je dejal oče: »Naberita drv, otroka, zakuril bom ogenj, da vaju ne bo zeblo.« Janko in Metka sta nanosila celo goro dračja. Prižgali so ga in ko je ogenj visoko vzplapolal, je rekla ženska: »Zdaj pa lezita k ognju, otroka, in se odpočijta, midva z očetom greva v gozd sekat les. Ko opraviva, se vrneva po vaju.«
 Janko in Metka sta sedela ob ognju in ko je bilo poldne, sta pojedla vsak svoj košček kruha. Ves čas sta slišala udarce sekire in bilo je, kakor da seka oče nekje v bližini. To pa ni bila sekira, marveč veja, ki jo je oče privezal ob trhlo drevo in je v vetru udarjala sem in tja. Otroka sta tako dolgo sedela ob ognju, da so se jima od utrujenosti začele zapirati oči. Trdno sta zaspala. Ko sta se zbudila, je bila že črna noč. Metka je začela jokati in je rekla : »Kako prideva zdaj iz tega gozda?« »Samo majceno počakaj,« jo je tolažil Janko. »Ko vzide mesec, bova že našla pot.« Ko se je prikazala luna na nebu, je Janko prijel sestrico za roko in šel za kamenčki, ki so se iskrili kakor novo kovani srebrniki in jima kazali pot. Hodila sta vso noč in prišla šele v svitu naslednjega dne spet do domače hiše. Potrkala sta na vrata in ko je ženska odprla in videla, da sta onadva, je rekla: »Otroka malopridna, kaj pa sta tako dolgo spala v hosti. Z očetom sva že mislila, da se nočeta vrniti.« Oče pa se ju je razveselil, kajti v srcu ga je grizlo, da ju je bil pustil tako sama. Minilo je nekaj časa, pa je spet iz vseh kotov pritisnilo pomanjkanje. In otroka sta slišala, kako je mačeha rekla ponoči očetu v postelji : »Spet nam je pošel ves živež, samo pol hlebca kruha še imamo, potlej bo pesmi konec. Otroka morata z doma. Odvedla ju bova še globlje v gozd, da ne bosta našla več poti iz njega. Drugače ni rešitve za naju.« Drvarju je bilo težko pri srcu in pomislil je: »Bolje bi bilo, da bi zadnji grižljaj delil s svojima otrokoma.«
 Toda pri ženski je bilo bob ob steno vse, kar je dejal. Oštevala ga je in ga obsipala z očitki. In ko je drvar že enkrat pristal, je moral še drugič. Otroka pa sta bila budna in sta slišala ves ta pomenek. Ko sta stara dva zaspala, je Janko spet vstal, hotel ven po kamenčke kakor zadnjikrat, toda ženska je zaklenila vrata in Janko ni mogel iz hiše. Vseeno pa je pomiril sestrico, ki je jokala: »Nič ne jokaj, Metka, kar mirno spi. Vse bo še dobro.« Navsezgodaj je prišla mačeha in vrgla otroka iz postelje. Dobila sta vsak svoj košček kruha, ki pa je bil še manjši kakor zadnjikrat. Na poti proti gozdu je Janko drobil kruh v žepu, se večkrat ustavil in vrgel drobtinico na pot. »Kaj pa se ustavljaš, Janko, in gledaš nazaj?« je rekel oče. »Pojdi svojo pot.« »Po svojem golobčku se oziram, ki sedi na strehi in se hoče posloviti od mene,« je odgovoril Janko. »Bedak,« je rekla ženska, »to ni tvoj golob, to je jutranje sonce, ki sije na dimnik.« Janko pa je polagoma zmetal vse drobtinice na pot. Mačeha je odvedla otroka še globlje v gozd, v tako goščo, kakršne še živ dan nista videla. Tam so spet zakurili velik ogenj in mačeha je rekla: »Kar lepo sedita tukaj, otroka, in če bosta trudna, lahko malo zaspita. Z očetom greva v gozd sekat les, in zvečer, ko opraviva svoje delo, prideva po vaju.« Opoldne je Metka delila svoj košček kruha z Jankom, ki je svojega raztrosil po poti. Nato sta zaspala. Minil je že večer, k ubogima otrokoma pa ni bilo žive duše. Prebudila sta se šele v črni noči in Janko je miril svojo sestrico in ji rekel: »Kar počakaj, Metka, da je miril svojo sestrico in ji rekel: »Kar počakaj, Metka, da
vzide mesec. Potlej bova lahko videla drobtinice, ki sem jih natrosil, da nama pokažejo pot domov.« Ko je vzšla luna, sta se odpravila, a nobene drobtinice ni bilo več na poti, kajti tisoč in tisoč ptic, ki so letale po gozdu in po polju, jih je pozobalo. »Tudi tako bova našla pot,« je rekel Janko Metki. A nista je našla. Hodila sta vso noč in še cel dan od jutra do večera, a nista prišla iz gozda. Bila sta zelo lačna, ker nista imela nič ,drugega kakor nekaj jagod, ki sta jih nabrala. Bila sta tudi že tako utrujena, da ju noge niso hotele več nositi. Tako sta legla pod neko drevo in zaspala. To je bilo že tretje jutro, odkar sta odšla iz hiše svojega očeta. Vzela sta spet pot pod noge, a sta zašla še globlje v gozd. Čutila sta, da bosta omagala in umrla, če ne pride kmalu kakšna pomoč. Ko je bilo okrog poldne, sta zagledala lepo, snežno belo ptico, ki je sedela na veji in tako prelepo gostolela, da sta se ustavila in ji prisluhnila. Ko je utihnila, je razpela krila in poletavala pred njima. Otroka sta šla za ptico, dokler nista prišla do neke hišice, kjer je ptica sedla na streho. Ko pa sta prišla čisto blizu, sta opazila, da je hišica iz kruha sezidana in s štrukeljčki pokrita; okenca pa so bila iz svetlega sladkorčka. »Tega se pa kar lotiva,« je rekel Janko Metki. »Privoščiva si pošteno južino. Jaz bom pojedel košček strehe, ti, Metka, pa vzemi košček okna, da se boš posladkala.« Janko je segel z roko in odlomil košček strehe, da bi videl, kako tekne. Metka pa se je lotila šipe in začela hrustati. Tedaj se je oglasil tenek glas iz sobe: »Hrst, brst, kateri miško kruši, hrusta mojo hiško«
 Otroka pa sta odgovorila »Vetrc, vetrc iz neba okrog hišice pihlja,« in sta jedla dalje ter se nista dala motiti. Janko, ki mu je streha prav dobro teknila, jo je iztrgal velik kos in Metka je potegnila ven celo okroglo šipo, sedla na tla in si privoščila. Tedaj pa so se nenadoma odprla vrata in ven je prišantala kakor zemlja stara ženska, ki se je opirala na bergle. Janko in Metka sta se tako prestrašila, da jima je popadalo na tla vse, kar sta držala v rokah. Starka pa je zmajevala z glavo in govorila: »Ejej, ljuba otroka moja, kdo pa vaju je pripeljal sem? Stopita no v hišo in ostanita pri meni. Nič hudega se vama ne bo zgodilo.« a se vama ne bo zgodilo.« Prijela ju je za roko in ju odpeljala v hišico. Tam so jima pripravili dobro kosilo, mleko in cvrtnjak s sladkorjem, jabolka in orehe. Nato so belo postlali dve lepi posteljici in Janko in in orehe. Nato so belo postlali dve lepi posteljici in Janko in Metka sta legla in sladko zaspala. Starka pa se je samo delala dobro. Bila je hudobna čarovnica, ki je prežala na otroke in je svojo kruhasto hišico sezidala samo zato, da bi jih privabila. Ko je prišel kak otrok v njeno samo zato, da bi jih privabila. Ko je prišel kak otrok v njeno oblast, ga je ubila, skuhala in ga požrla. Čarovnice imajo rdeče oči in ne morejo videti daleč. Imajo pa tenek voh kakor živali in zaduhajo, če pridejo ljudje v bližino. Ko sta se Janko in Metka bližala njeni hišici, se je ženska zlobno zasmejala in posmehljivo dejala: »Ta dva sta mi padla v kremplje. Ne bosta mi popihala.« Zgodaj zjutraj, ko sta otroka še spala, je že vstala in ko ju je videla, kako milo spita s svojimi polnimi rdečimi lički, je zamrmrala predse: »To bo slasten prigrizek!«
 Zgrabila je Janka s svojimi koščenimi rokami ga odnesla v majhen hlev in ga zaprla za zamrežena vrata. Ni mu pomagalo, da je kričal in vpil na vse grlo. Nato je stopila k Metki in jo stresla, da se je zdramila. Zaklicala ji je: »Vstani, zaspanka, nanosi vode in skuhaj svojemu bratu kaj dobrega. Zaprt je v hlevu, da se bo zredil. Ko bo lepo rejen, ga bom pojedla.« Metka je bridko zajokala, a bilo je vse zaman, morala je storiti, kar je zahtevala hudobna čarovnica. Tako so ubogemu Janku kuhali najboljše jedi, Metka pa je dobivala samo ostanke. Vsako jutro je odšantala starka k hlevčku in zaklicala: »Janček, pomoli ven svoj prst, da bom potipala, ali boš kmalu rejen.« Janko pa ji je pomolil koščico in starka, ki je imela brljave oči, tega ni mogla videti in je mislila, da so Jankovi prsti, ter se čudila, da se kar nič ne zredi. Ko so minili štirje tedni in je Janko ostal še kar suh, jo je premagala nepotrpežljivost in ni marala več čakati. Metka,« je zaklicala deklici, »skoči hitro in nanosi vodo. Naj bo Janko debel ali suh, jutri ga bom zaklala in ga skuhala.« Oh, kako je jokala uboga deklica, ko je morala nositi vodo! Kako so ji tekle solze po licih! »Bolje bi bilo, da bi naju požrle divje zveri v gozdu. Tako bi vsaj skupaj umrla!« je tarnala. »Nikar se ne cmeri,« jo je osorno zavrnila starka, »to vse ti ne bo prav nič pomagalo.« Metka je morala zgodaj zjutraj obesiti kotel z vodo in zakuriti ogenj. »A najprej moramo speči kruh,« je rekla starka. »Krušno peč sem že zakurila in tudi testo zamesila!«
Pahnila je ubogo Metko pred peč, iz katere so že švigali plameni. »Zlezi vanjo,« je rekla čarovnica, »in poglej, ali je dovolj zakurjeno, da lahko damo kruh vanjo.« In če bi jo bila Metka poslušala, bi čarovnica zaprla v jo peč, da bi se Metka spekla v nji. In potem bi o bila pojedla. Metka pa je uganila, kaj stara namerava in je rekla: »Ne vem, kako naj to storim. Kako pa pridem vanjo?« »Gos neumna, saj je odprtina dovolj velika, vidiš, še jaz bi lahko zlezla vanjo,« je rekla stara, se primajala in vtaknila glavo v peč. Metka pa jo je krepko sunila, da je zdrsnila vanjo. Zaprla je železna vrata za njo. Oh, kako grozansko je zavreščala stara! A nič ni pomagalo. Čarovnica je morala zgoreti. Metka je jadrno stekla naravnost k Janku, odprla njegov hlevček in zaklicala: »Janko, rešena sva, stara čarovnica je mrtva!« Janko je skočil ven kakor ptička iz kletke, če ji odpreš vratca. Kako sta se veselila! Vrgla sta se drug drugemu okoli vratu, poskakovala in se poljubljala! In ker se jima ni bilo treba ničesar več bati, sta šla v čarovničino hišo. Tam pa so bili po vseh kotih zabojčki z biseri in dragulji. »Ti so pa veliko boljši kakor kamenčki,« je rekel Janko in si jih natlačil v žepe, kolikor je mogel. »Tudi jaz bi rada kaj prinesla domov,« je rekla Metka ter si z njimi napolnila svoj predpasniček. »Zdaj pa jo pobrišiva od tod,« je dejal Janko, »da prideva iz tega čarovniškega gozda.« a nekaj Ko sta hodila ur, sta prišla do velike vode. »Saj ne moreva čez videti.« ,« je dejal Janko, »ne brvi ne mostu ni videti.«
 »Tudi nobene barčice ni na vodi,« mu je odgovorila Metka »tamle pa plava bela račka. Če jo poprosim, nama bo gotovo Pomagala čez vodo.« Vzkliknila je: »Račka, ljuba račka ti, ker ni mostička ne brvi, midva prosiva lepo, da naju prepelješ čez vodo.« In račka je res priplavala in Janko ji je sedel na hrbet in rekel sestrici, naj sede zraven njega. »Ne,« je odgovorila Metka, »to bi bilo za račko pretežko, drugega za drugim naju bo.« In dobra račka je res storila tako in ko sta bila srečno na drugem bregu in ko sta še nekaj časa hodila, se jima je zazdel gozd čedalje bolj znan in domač. In nazadnje sta od daleč zagledala hišo svojega očeta. Začela sta teči, planila sta v sobo in se vrgla očetu okrog vratu. Odkar je revni drvar pustil svoja otroka v gozdu, ni imel niti trenutka miru in pokoja več. Njegova hudobna žena pa je bila medtem umrla. Metka je stresla iz svojega predpasnička bisere in dragulje, da so se kar trkljali po izbi. Janko pa ",2484
6,Kralj_Drozd,"Neki kralj je imel hčer, ki je bila tako neizmerno lepa, zraven pa tako ošabna in prevzetna, da ji noben snubač ni bil dovolj dober. Zavrnila je drugega za drugim, povrhu pa jih je še obsula s posmehom. Nekoč je kralj priredil veliko slavje in je povabil nanj vse ženitve željne moške od blizu in daleč. Vse jih je razvrstil po činu in stanu: najprej so prišli kralji, potlej vojvode, knezi, grofi, vitezi, nazadnje plemiški ljudje. Peljali so kraljično mimo vseh, ta pa je imela za vsakega kakšno pikro besedo. Nekdo je bil predebel: »Sod vinski,« je rekla. Drugi predolg: »Dolgokrak, omahljiv korak.« Tretji prekratek: »Kratek in rejen, štor zavaljen!« Četrti prebledi »Bledica Smrt!« Peti prerdeč: »Petelin na strehi!« Šesti ni bil dovolj raven: »Kriv ko dren, v zapečku posušen!« Res, prav vsem je imela kaj očitati, posebno pa se je znesla nad nekim dobrim kraljem, ki je stal čisto zgoraj in ki je imel malo krivo raščeno brado. »Ej,« je vzkliknila in se zasmejala, »ta ima pa brado kakor drozgov kljun.« In od tega časa dalje je dobil ime Drozgobrad ali kratko: kralj Drozd. Stari kralj pa, ki je videl, da njegova hči ne počne drugega, kakor da se posmehuje ljudem in zavrača vse snubače, ki so bili zbrani tam, se je silno razjezil. Prisegel je, da bo morala vzeti prvega berača, ki mu pride skozi vrata. 

Nekaj dni zatem se je oglasil pod oknom godec in pel pesmico, da bi si prislužil majhno miloščino. Ko ga je kralj zaslišal, je ukazal, naj ga pokličejo gor. Godec je vstopil v svoji umazani, razcapani obleki, zapel pred kraljem in njegovo hčerjo ter prosil za nagrado, ko je končal. »Tvoja pesem mi je tako ugajala, da ti hočem dati svojo hčer za ženo,« je rekel kralj. Kraljična se je zelo ustrašila, kralj pa je dejal: »Prisegel sem, da te bom dal prvemu beraču, in to prisego bom tudi izpolnil.« Vsi izgovori in prošnje niso nič pomagali, poklicali so župnika, da jo je pri priči poročil z godcem. Ko se je to zgodilo, je kralj rekel: »Ne spodobi se, da bi zdaj kot žena beračeva še dalje ostala pod mojo streho. Zato lahko odideš s svojim možem.« Berač jo je odvedel za roko in morala je peš hoditi z njim. Ko sta prišla do nekega velikega gozda, je vprašala: »Čigav je ta prelepi gozd?« »Njegov posestnik je kralj Drozd; da si ga vzela, bil bi tvoj.« »o, da, ubožica sem mlada, zavrgla kralja Drozgobrada!« Nato sta prišla na travnik, pa je spet vprašala: »Čigav je krasni travnik ta?« »Kralj Drozd v posesti ga ima, da si ga vzela, bil bi tvoj.« »O, da, ubožica sem mlada zavrgla kralja Drozgobrada!« Potem sta hodila po velikem mestu; spet je vprašala: »Čigavo pa je lepo mesto to?« »To mesto Drozdov grad zovo

da si ga vzela, tvoje bi bilo.« »o, da, ubožica sem mlada, zavrgla kralja Drozgobrada!« »Prav nič mi ne ugaja,« je rekel godec, »da si vedno želiš nekoga drugega za moža. Mar jaz nisem dovolj dober zate?« Nazadnje sta prišla do čisto majhne hišice. Rekla je: »o, majhna nizka hišica! Čigava je ta kočica?« »To je moja in tvoja hiša, kjer bova stanovala,« je odgovoril godec in vstopil. Tudi ona je vstopila, a se je morala pripogniti, da je prišla skozi vrata. »Kje so pa sluge?« je vprašala kraljična. »Kakšni sluge?« je odgovoril ubogi prosjak. »Sama boš morala storiti, kar boš hotela imeti storjeno. Daj, kar pr&ej zakuri in pristavi vodo, da mi skuhaš kosilo. Tako sem utrujen.« Kraljeva hči pa ni znala ne kuriti ne kuhati in prosjak je moral pomagati, da je za silo šlo. Ko sta použila svojo pičlo večerjico, sta legla spat. Zjutraj je prosjak že navsezgodaj dvignil svojo ženo na noge, ker je morala pospravljati. Nekaj dni sta živela tako, kakor je pač šlo. Pri tem pa sta porabila svojo zalogo. Zato je rekel mož: »Žena, ne gre več tako, da bi samo jedla in nič ne zaslužila. Košare boš pletla.« Šel je in narezal vrbovih šib ter jih prinesel domov. Začela je plesti, toda trdo vrbovje ji je do krvi ranilo občutljive roke. »Vidim, da ti ne gre,« je rekel mož, »rajši se loti presti, nemara znaš to bolje.« Sedla je h kolovratu in poskusila presti, toda trda nit se ji je kmalu zarezala v mehke prste, da se je pocedila kri iz njih. 

»Sama vidiš, da nisi za nobeno rabo, slabo sem jo skupil s teboj,« je rekel mož in dodal: »Poskusil bom začeti še trgovino z lonci in lončeno posodo. Sedela boš na trgu in ponujala blago na prodaj.« »Oh,« je pomislila, »če pridejo na trg ljudje iz dežele mojega očzia in me vidijo, da sedim tam in ponujam na prodaj, kako se mi bojo posmehovali!« Toda nič ni pomagalo, morala se je vdati, če ni hotela od lakote umreti. Prvikrat je šlo dobro. Ljudje so namreč radi kupovali pri ženi, ki je bila lepa, ter plačevali, kar je zahtevala. Res, marsikdo ji je dal denar, lonce pa kar pustil. Tako sta živela s pridobljenim, dokler je trajalo. Mož je spet nakupil zalogo nove posode. Sedla je s tem na vogal trga, razpostavila posodo okrog sebe in ponujala na prodaj. Tedaj pa je naenkrat pridirjal pijan huzar izza vogala in se zaletel naravnost v lonce, da se je vse razletelo na tisoč črepinj. Žena je zajokala in od strahu ni vedela, kaj bi. »Oh, kaj bo z menosj!«' je zastokala. »Kaj poreče moj mož!« Stekla je domov in mu povedala o svoji nesreči. »Kdo pa tudi seda z lončeno posodo na vogal!« je rekel mož. »Pusti zdaj solze, saj vidim, da nisi za nobeno pravo delo. Bil sem na gradu našega kralja in vprašal, ali bi potrebovali kakšno kuhinjsko deklo. Obljubili so mi, da te vzamejo. Za plačilo boš imela prosto hrano.« Tako je postala kraljeva hči kuhinjska dekla. Morala je pomagati kuharju in opravljati najbolj nečedno delo. V oba žepa si je pritrdila dva lončka. V njih je prinašala domov, kar je bilo ostankov. In s tem sta se hranila. Namerilo se je, da bi morali praznovati svatbo najstarejšega kraljevega sina. Ubogo ženo je gnala radovednost, da je šla, se postavila pred vrata v dvorano in hotela gledati. 

Ko so zagorele luči in so prihajali gostje, eden lepši od drugega, in je bilo vse polno krasote in sijaja, je s potrtim srcem pomislila na svojo usodo ter preklinjala svojo ošabnost in prevzetnost, ki sta jo ponižali in jo pahnili v tako revščino. Sluge so ji od slastnih jedil, ki so jih nosili v dvorano in spet odnašali in iz katerih se je dvigal prijeten duh k nji, vrgli tu pa tam kak grižljaj, ki ga je spravila v svoj lonček, da bi ga nesla domov. Naenkrat je vstopi], kraljevič. Oblečen je bil v svilo in žamet in okrog vratu je imel zlate verižice. In ko je zagledal lepo ženo pred vrati, jo je prijel za roko in hotel zaplesati z njo. Ona pa se je branila in se prestrašila. Opazila je namreč, da je to kralj Drozgobrad, ki se je nekoč potegoval zanjo in ga je z zasmehom zavrnila. Nič ni pomagalo, da se je upirala, kraljevič jo je potegnil v dvorano. Tedaj pa se ji je utrgal trak, s katerim sta bila privezana žepa, in lončka sta padla na tla, da se je juha z jedili razlila po tleh. In ko so ljudje to videli, je nastal splošen krohot in porogljiv smeh, njo pa je bilo tako sram, da bi bila najrajši tisoč klafter pod zemljo. Skočila je skozi vrata in hotela pobegniti, na stopnicah pa jo je ujel neki moški in jo privedel nazaj; in ko se je ozrla vanj, je bil to spet kralj Drozgobrad. Prijazno ji je dejal: »Nič se ne boj, jaz in tisti godec, ki je stanoval s teboj v borni hišici, sva eno. Zaradi tebe sem se tako prenaredil, in tisti huzar, ki ti je razbil vse lonce, sem bil tudi jaz. To vse se je zgodilo, da bi se upognila tvoja prevzetnost in bi bil kaznovan tvoj napuh, s katerim si me zasramovala.« Tedaj se je žena bridko razjokala in rekla: »Veliko krivico sem storila in nisem vredna, da bi ti bila žena.« 

On pa ji je rekel: »Potolaži se, hudi dnevi so pri kraju, zdaj bova praznovala svojo svatbo.« In so prišle spletične in jo oblekle v najkrasnejša oblačila. Prišel je tudi oče in veš dvor in želeli so ji srečo s kraljem Drozgobradom. In pravo veselje se je šele zdaj začelo. 

",1418
